title,,,,,hymn_tune_title,,,,book,,,,,,,,page_number,,composer,,,holiday
"Rejoice, the Lord is King",,,,,Darwall's 148th,,,,Love Divine: Six Hymntunes on Wesley Texts,,,,,,,,20,,Burkhardt,,,
"Rejoice, the Lord is King",,,,,,,,,"Rejoice, the Lord Is King",,,,,,,,3,,Haan,,,
"Rejoice, the Lord is King",,,,,Darwall's 148th,,,,Power and Praise: Festive Organ Music for the Service,,,,,,,,3,,Smith,,,
Remembrance,,,,,,,,,Communion Call-Meditations for Organ,,,,,,,,22,,Binckes,,,
Remembrance,,,,,,,,,Communion Call-Meditations for Organ,,,,,,,,33,,Koury,,,
Restful Moment Interlude,,,,,,,,,Chimings for Organ,,,,,,,,21,,Moore,,,
Restoration,,,,,Restoration,,,,Americana Organ Settings of Early American Hymns,,,,,Vol 2,,,10,,Martin,,,
"Ride On, Ride On in Majesty",,,,,Winchester New,,,,"Were You There: Easy Hymn Preludes for Palm Sunday, Holy Week, and Easter",,,,,,,,4,,Kerr,,,Palm Sun
Rigaudon,,,,,,,,,The Complete Wedding Collection,,,,,,,,31,,Campra,,,
Rigaudon from Idominee,,,,,,,,,From This Day Forward,,,,,,,,80,,Campra,,,
Rise and Rejoice,,,,,,,,,Go Forth in Faith: Festive Music of Praise for Organ,,,,,,,,34,,Ritter,,,
Rise Up and Serve the Lord,,,,,Festal Song,,,,The Complete Organist,,,,,,,,105,,Harris,,,Missions
"Rise Up, O Saints of God",,,,,Festal Song,,,,Hymns for the Saints for Organ,,,,,,,,4,,Burkhardt,,,
"Rise, O Children of Salvation",,,,,Unser herrscher,,,,Pipe Dusters Vol 3,,,,,,,,23,,Bliss,,,
"Rock of Ages, Cleft for Me",,,,,Toplady,,,,Diane Bish Organ Book,,,,,,,,10,,Bish,,,
"Rock of Ages, Cleft for Me",,,,,Redhead,,,,Choral Preludes based on Famous Hymn Tunes Vol 1 (Lent),,,,,,,,15,,Rowley,,,Lent
"Rondeau from Premiere Suite, 1st Movement",,,,,,,,,The Complete Wedding Collection,,,,,,,,60,,Mouret,,,
"Rondeau from Suitte de simphonies, No 1",,,,,,,,,From This Day Forward,,,,,,,,72,,Mouret,,,
Safe in His Care,,,,,,,,,Chimings for Organ,,,,,,,,11,,Paxton,,,
Salvation,,,,,Salvation,,,,Americana Organ Settings of Early American Hymns,,,,,Vol 2,,,22,,Martin,,,
Samanthra,,,,,,,,,Eight Quiet Preludes on American Hymntunes,,,,,,,,21,,Callahan,,,
Sarabande,,,,,,,,,Baroque Music for Manuals,,,,,,,,17,,Leclair,,,
"Savior, Like a Shepherd Lead Us",,,,,,,,,From This Day Forward,,,,,,,,23,,Bradbury,,,
"Savior, Thy Dying Love",,,,,Something for Jesus,,,,Come to the Alter,,,,,,,,15,,Smith,,,
"Savior, When in Dust to Thee",,,,,Spanish Chant,,,,The Parish Organist Part Three,,,,,,,,56,,Bunjes,,,
"Saviour of the nations, Come",,,,,"Nun Komm, der Heiden Heiland",,,,The Parish Organist Part Three,,,,,,,,10,,Buttstedt,,,
"Saviour, Again to Thy Dear Name",,,,,Ellers,,,,Favorite Hymns for Organ,,,,,,,,20,,Hebble,,,
"Saviour, Like a Shepherd Lead Us",,,,,,,,,Softly and Tenderly: Organ Meditations on Well-Known Gospel Hymns,,,,,,,,26,,Wood,,,
See How Great a Flame Aspires,,,,,Arfon,,,,Pull Out All the Stops Volume 3,,,,,,,,25,,Scriveyner,,,
"See, the Conqueror Mounts in Triumph",,,,,Rex Gloriae,,,,The Parish Organist Part Twelve,,,,,,,,12,,Niblock,,,
Send the Light,,,,,McCabe,,,,Blessed Be the Name,,,,,,,,39,,Turner,,,
Sent Forth by God's Blessing,,,,,The Ash Grove,,,,11 Compositions for Organ Set 5,,,,,,,,50,,Ore,,,
Serenade,,,,,,,,,Prelude to the Wedding for Organ,,,,,,,,40,,Widor,,,
Serenity,,,,,,,,,Chimings for Organ,,,,,,,,25,,Wells,,,
Shall We Gather at the River,,,,,At the River,,,,American Folk Hymn Suite for Organ,,,,,,,,7,,Burkhardt,,,
Shall We Gather at the River,,,,,,,,,Best Ever Gospel Songs for Organ,,,,,,,,21,,Sewell,,,
Shall We Gather at the River,,,,,Hanson Place,,,,Our Gospel Legacy: Easy Hymn Arrangements for Organ,,,,,,,,3,,Smith,,,
Share His Love With All the World,,,,,,,,,Go Forth in Faith: Festive Music of Praise for Organ,,,,,,,,10,,Watkins,,,
Shepherds! Shake Off Your Drowsy Sleep,,,,,,,,,Spirituals and More for Organ,,,,,,,,22,,Rinehart,,,
Simple Gifts,,,,,,,,,Favorite Hymns for Organ,,,,,,,,3,,Hebble,,,
Simple Gifts,,,,,,,,,Simple Gifs: Four American Hymn Preludes for Organ,,,,,,,,4,,Kosche,,,
Sinfonia,,,,,,,,,Baroque Music for Manuals,,,,,,,,15,,Purcell,,,
Sing a New Song,,,,,,,,,Sing a New Song,,,,,,,,14,,Wagner,,,
Sing Praise to God,,,,,Mit Freuden Zart,,,,Ancient of Days 3 Hymns of Praise,,,,,,,,2,,Laubengaye,,,
Sing Praise to God Who Reigns Above,,,,,Mit Freuden Zart,,,,Every Time I Feel the Spirit,,,,,,,,28,,Elliott,,,
Sing Praise to God Who Reigns Above,,,,,Mit Freuden Zart,,,,"Loud Praise to Christ, Our King! Festive Hymn Settings for Organ",,,,,,,,40,,Martin,,,
Sing to God with Heart and Voice,,,,,,,,,From This Day Forward,,,,,,,,90,,Williams,,,
Sing to His Name,,,,,,,,,Pipe Dusters Vol 3,,,,,,,,26,,Martin,,,
Sing to the Lord of Harvest,,,,,Steurlein,,,,Pipe Dusters Vol 3,,,,,,,,16,,Eliot,,,Thanksgivin
Sing to the Lord of Harvest,,,,,Steurlein,,,,Power and Praise: Festive Organ Music for the Service,,,,,,,,36,,Eliot,,,
Sing We Now of Christmas,,,,,French Carol,,,,Easy Organ Library Vol 58,,,,,,,,55,,Krug,,,Christmas
Sing We Now of Christmas,,,,,,,,,Big Brown Book of Organ Solos,,,,,,,,82,,Griffin,,,
Slane,,,,,Slane,,,,"O Love, How Deep: Three Hymn Settings for Organ",,,,,,,,3,,Phillips,,,
Softly and Tenderly,,,,,,,,,Blessed Assurance,,,,,,,,35,,Varner,,,
Softly and Tenderly,,,,,Thompson,,,,Best Ever Gospel Songs for Organ,,,,,,,,6,,Stockton,,,
Softly and Tenderly,,,,,,,,,Gospel Hymn Settings,,,,,,,,2,,Held,,,
Softly and Tenderly,,,,,,,,,Organ Preludes on Hymns Old and New,,,,,,,,9,,Hustad,,,
Softly and Tenderly,,,,,,,,,Three Nineteenth Century Revival Hymns,,,,,,,,12,,Ferguson,,,
Softly and Tenderly,,,,,,,,,Softly and Tenderly: Organ Meditations on Well-Known Gospel Hymns,,,,,,,,5,,Wood,,,
Soldiers of the Lord,,,,,,,,,Power and Praise: Festive Organ Music for the Service,,,,,,,,29,,Hill,,,
Someone's Praying Lord,,,,,Kum Ba Yah,,,,Easy Organ Library Vol 58,,,,,,,,98,,Wagner,,,
Somerset Hills,,,,,Somerset Hills,,,,The Bristol Collection,,,,,,,,15,,Hancock,,,
Song For a New Year,,,,,,,,,The Organist in Season: Winter,,,,,,,,38,,Martin,,,Epiphany
Soul Adorn Thyself with Gladness,,,,,Schmuecke dich,,,,The Parish Organist Part Three,,,,,,,,52,,Brahms,,,
Sound the Trumpet of Victory,,,,,,,,,"O Sacred Head: An Organ Collection for Palm Sunday, Holy Week and Easter",,,,,,,,44,,Harris,,,Easter
Souvenir,,,,,,,,,Prelude to the Wedding for Organ,,,,,,,,24,,Hegarty,,,
Spirit of God,,,,,Morecambe,,,,The Complete Organist,,,,,,,,69,,Smith,,,Pentecost
"Spirit of God, Descend Upon My Heart",,,,,Morecambe,,,,Hymns for Organ: Artistic Expressions of Faith and Joy,,,,,,,,11,,Hayes,,,
"Spirit of God, Descend Upon My Heart",,,,,,,,,Organ Preludes on Hymns Old and New,,,,,,,,14,,Hustad,,,
"Spread, Oh Spread, Thou Mighty Word",,,,,Hochster Priester,,,,The Parish Organist Part Twelve,,,,,,,,42,,Bouman,,,
St. Anne Ricercare,,,,,St. Anne,,,,The Organist in Season: Summer,,,,,,,,28,,Young,,,General
St.Anthony Chorale,,,,,St. Anthony,,,,The Parish Organist: Wedding Music,,,,,,,,21,,Brahms,,,
"Stand Up, Stand Up for Jesus",,,,,,,,,Pipe Dusters,,,,,,,,53,,Mansfield,,,
Stretch Forth Thine Hane to Heal,,,,,,,,,Favorite Hymns for Organ,,,,,,,,30,,Hebble,,,
"Stricken, Smitten, and Afflicted",,,,,"O Mein Jesu, Ich Muss Sterben",,,,"Were You There: Easy Hymn Preludes for Palm Sunday, Holy Week, and Easter",,,,,,,,16,,Kerr,,,Lent
Surely Goodness and Mercy,,,,,,,,,He Leadeth Me: Organ Solos,,,,,,,,16,,Whitworth,,,
Sweet Hour of Prayer,,,,,Sweet Hour,,,,Chimings for Organ,,,,,,,,12,,Ritter,,,
Sweet Hour of Prayer,,,,,,,,,Best Ever Gospel Songs for Organ,,,,,,,,24,,Bradbury,,,
Sweet Hour of Prayer,,,,,,,,,Organ Preludes on Hymns Old and New,,,,,,,,28,,Hustad,,,
Sweet Hour of Prayer,,,,,Sweet Hour,,,,Nine Hymn Preludes for Organ,,,,,,,,10,,Young,,,
Sweet Hour of Prayer,,,,,,,,,A Quiet Time in the Garden of Prayer,,,,,,,,2,,Caudill,,,
Sweet Hour of Prayer,,,,,,,,,Softly and Tenderly: Organ Meditations on Well-Known Gospel Hymns,,,,,,,,17,,Wood,,,
"Sweet, Sweet Spirit",,,,,,,,,A Quiet Time in the Garden of Prayer,,,,,,,,35,,Caudill,,,
Swing Five,,,,,"Erhault uns, Herr",,,,"Organ, Timbrel, and Dance",,,,,,,,4,,Michel,,,
Symphony from the Bell Anthem,,,,,,,,,The Parish Organist: Wedding Music,,,,,,,,17,,Purcell,,,
Take My Life and Let It Be,,,,,Hendon,,,,Come to the Alter,,,,,,,,6,,Smith,,,
Take My Life and Let It Be,,,,,Hendon,,,,God With Us: Eleven Pieces for Organ,,,,,,,,30,,Diemer,,,
Take My Life and Let It Be,,,,,Patmos,,,,The Parish Organist Part Three,,,,,,,,34,,Hulse,,,
"Take This Bread, Take This Cup",,,,,,,,,Communion Call-Meditations for Organ,,,,,,,,44,,Smith,,,
Take Thou My Hands and Lead Me,,,,,So nimm denn meine Haende,,,,The Parish Organist: Wedding Music,,,,,,,,22,,Wienhorst,,,
Take Time to Be holy,,,,,Holiness,,,,Close to Thee: Artistic Organ Settings of Eduring Gospel Songs,,,,,,,,4,,Southbridge,,,
Take Time to Be holy,,,,,Holiness,,,,Best Ever Gospel Songs for Organ,,,,,,,,18,,Smith,,,
Te Deum,,,,,,,,,The Complete Wedding Collection II,,,,,,,,22,,Charpentier,,,
Tell Me About Jesus,,,,,,,,,Fill the Earth With Music: Easy Music for Organ,,,,,,,,29,,Keyser,,,
Tell Me the Story of Jesus,,,,,Story of Jesus,,,,Best Ever Gospel Songs for Organ,,,,,,,,12,,Becket,,,
The Bells of Christmas,,,,,Det kimer Nu Til Julefest,,,,Festive Hymn Settings for Advent Christmas and Epiphany,,,,,,,,34,,Burkhardt,,,Christmas
The Brightest Trumpet,,,,,,,,,Power and Praise: Festive Organ Music for the Service,,,,,,,,18,,Ritter,,,
The Call to Victory,,,,,,,,,God of Glory: Easy Festive Postludes for Organ,,,,,,,,26,,Paxton,,,
The Call to Victory,,,,,,,,,Pull Out All the Stops Volume 3,,,,,,,,28,,Paxton,,,
The Church's One Foundation,,,,,Aurelia,,,,The Complete Organist,,,,,,,,108,,Scott,,,Reformation
The Church's One Foundation,,,,,,,,,Organ Preludes on Hymns Old and New,,,,,,,,1,,Hustad,,,
The Church's One Foundation,,,,,Aurelia,,,,Six General Hymn Improvisations Set 2,,,,,,,,13,,Burkhardt,,,
The Church's One Foundation,,,,,Aurelia,,,,Pull Out All the Stops Volume 3,,,,,,,,13,,Mansfield,,,
The Clarion Call,,,,,,,,,Pull Out All the Stops Volume 3,,,,,,,,34,,Smith,,,
"The Day Thou Gavest, Lord, Is Ended",,,,,St. Clement,,,,God With Us: Eleven Pieces for Organ,,,,,,,,18,,Diemer,,,
The Everlasting Arms,,,,,,,,,Gospel Hymn Settings,,,,,,,,4,,Held,,,
The Everlasting Arms,,,,,Showalter,,,,The Everlasting Arms,,,,,,,,3,,Smith,,,
The Festive Trumpet,,,,,,,,,Pull Out All the Stops Volume 3,,,,,,,,16,,Glyncannon,,,
The First Noel ,,,,,The First Nowell,,,,Festive Hymn Settings for Advent Christmas and Epiphany,,,,,,,,40,,Burkhardt,,,Christmas
The First Noel ,,,,,The First Nowell,,,,Festive Hymn Settings for Advent Christmas and Epiphany,,,,,,,,40,,Burkhardt,,,Epiphany
The Garden of Prayer,,,,,,,,,The Complete Organist,,,,,,,,14,,Broughton,,,Holy Week
The Gates of Jerusalem,,,,,,,,,"O Sacred Head: An Organ Collection for Palm Sunday, Holy Week and Easter",,,,,,,,12,,Paxton,,,Palm Sun
The Gift of Love,,,,,,,,,Four Hymn Meditations for Organ,,,,,,,,10,,Pethel,,,
The God of Abraham Praise,,,,,Leoni,,,,Churchworks,,,,,,,,10,,Koch,,,
The God of Abraham Praise,,,,,Leoni,,,,Five Preludes on Familiar Hymns for Organ,,,,,,,,8,,Hopson,,,
The God of Abraham Praise,,,,,Leoni,,,,Every Time I Feel the Spirit,,,,,,,,18,,Elliott,,,
The God of Abraham Praise,,,,,Leoni,,,,Nine Hymn Preludes for Organ,,,,,,,,6,,Young,,,
The God of Abraham Praise,,,,,Yigdal,,,,Praise and Thanksgiving Hymn Improvisations Set 3,,,,,,,,9,,Burkhardt,,,
The Golden Carol,,,,,,,,,Spirituals and More for Organ,,,,,,,,18,,Rinehart,,,
The Greatness of the Lord,,,,,,,,,Go Forth in Faith: Festive Music of Praise for Organ,,,,,,,,14,,Miles,,,
The Head That Once Was Crowned,,,,,St. Magnus,,,,Six Preludes for the Church Year,,,,,,,,20,,Hobby,,,Easter
The Head That Once Was Crowned,,,,,St. Magnus,,,,The Parish Organist Part Twelve,,,,,,,,32,,Barlow,,,
The Holly and the Ivy,,,,,,,,,Big Brown Book of Organ Solos,,,,,,,,88,,Torrans,,,
The Holy Wings,,,,,Bred Dina Vida Vingar,,,,Morning Has Broken: Three Quiet Hymn Settings for Worship,,,,,,,,8,,Langlois,,,
The Joyful Trumpet,,,,,,,,,Go Forth in Faith: Festive Music of Praise for Organ,,,,,,,,19,,Harris,,,
The Joyous Heart,,,,,,,,,God of Glory: Easy Festive Postludes for Organ,,,,,,,,6,,Peterson,,,
The King of Glory,,,,,,,,,Easter Glory! Festive Organ Music for the Season,,,,,,,,32,,Wells,,,Easter
The King of Love My Shepherd Is,,,,,St. Columba,,,,Favorite Hymns for Organ,,,,,,,,48,,Hebble,,,
The King of Love My Shepherd Is,,,,,St. Columba,,,,Funeral Music for a Manuals,,,,,,,,6,,Callahan,,,Funeral
The King of Love My Shepherd Is,,,,,St. Columba,,,,The Parish Organist Part Twelve,,,,,,,,20,,Krapf,,,
The King Shall Come,,,,,Consolation,,,,An American Suite for Organ,,,,,,,,16,,Dahl,,,
The King Shall Come,,,,,Wyeth's Repository of Sacred Music,,,,Americana Organ Settings of Early American Hymns,,,,,,,,5,,Martin,,,
The King Shall Come when Morning Dawns,,,,,St. Stephen,,,,The Parish Organist Part Twelve,,,,,,,,38,,Manz,,,
"The Lone, Wild Bird",,,,,Prospect,,,,Easy Organ Library Vol 58,,,,,,,,15,,Lau,,,
"The Lone, Wild Bird",,,,,Prospect,,,,Eight Hymn Preludes for Organ,,,,,,,,7,,Diemer,,,
"The Lord Reigns, Alleluia!",,,,,,,,,God of Glory: Easy Festive Postludes for Organ,,,,,,,,29,,Peterson,,,
The Lord's My Shepherd,,,,,,,,,"Rejoice, the Lord Is King",,,,,,,,40,,Haan,,,
"The Lord's My Shepherd, I'll Not Want",,,,,Crimond,,,,Nine Hymn Preludes for Organ,,,,,,,,25,,Young,,,
The Love of God,,,,,Love of God,,,,Glad Adoration,,,,,,,,43,,Hamlin,,,
The Master Has Called Us,,,,,Ash Grove,,,,Gather in Praise: Ten Hymns of Praise for Organ,,,,,,,,24,,Ritter,,,
The Master Has Called Us,,,,,Ash Grove,,,,Four Hymn Meditations for Organ,,,,,,,,18,,Pethel,,,
The Master Hath Come,,,,,Ash Grove,,,,Fill the Earth With Music: Easy Music for Organ,,,,,,,,1,,Bailey,,,
The Name of Jesus,,,,,,,,,Blessed Be the Name,,,,,,,,26,,Lorenz,,,
The Old Rugged Cross,,,,,Old Rugged Cross,,,,Fill the Earth With Music: Easy Music for Organ,,,,,,,,12,,Keyser,,,
The Old Rugged Cross,,,,,The Old Rugged Cross,,,,Our Gospel Legacy: Easy Hymn Arrangements for Organ,,,,,,,,6,,Thygerson,,,
The Old Rugged Cross,,,,,,,,,A Quiet Time in the Garden of Prayer,,,,,,,,18,,Caudill,,,
The Old Rugged Cross,,,,,,,,,Softly and Tenderly: Organ Meditations on Well-Known Gospel Hymns,,,,,,,,29,,Wood,,,
The People That in Darkness Sat,,,,,"Lobt Gott, Ihr Christen",,,,Festive Hymn Settings for Advent Christmas and Epiphany,,,,,,,,59,,Burkhardt,,,Christmas
The Power and the Glory,,,,,,,,,Pull Out All the Stops Volume 3,,,,,,,,43,,Smith,,,
The Precious Blood of Jesus,,,,,,,,,Blessed Be the Name,,,,,,,,32,,Broughton,,,
The Risen Christ!,,,,,,,,,The Complete Organist,,,,,,,,94,,Peterson,,,Easter
The Shepherd's Song,,,,,Drew,,,,The Organist in Season: Winter,,,,,,,,24,,Martin,,,Christmas
The Solid Rock,,,,,Solid Rock,,,,The Everlasting Arms,,,,,,,,12,,Smith,,,
The Stranger of Galilee,,,,,,,,,Blessed Be the Name,,,,,,,,20,,Keeney,,,
The Strife is O'er,,,,,Victory,,,,Risen & Exalted An Eastertide Celebration for Organ,,,,,,,,3,,Smith,,,Easter
The Strife is O'er,,,,,Victory,,,,Funeral Music for a Manuals,,,,,,,,8,,Callahan,,,Funeral
The Strife is O'er,,,,,Victory,,,,Easter Glory! Festive Organ Music for the Season,,,,,,,,28,,Smith,,,Easter
The Trumpet Shall Sound,,,,,,,,,Easter Glory! Festive Organ Music for the Season,,,,,,,,24,,Handel,,,Easter
The Trumpets of Heaven,,,,,,,,,Pipe Dusters Vol 3,,,,,,,,3,,Paxton,,,
The Voice That Breathed O'er Eden,,,,,Eden,,,,Choral Preludes based on Famous Hymn Tunes Vol 5,,,,,,,,23,,Rowley,,,
The Way of the Cross Leads Home,,,,,Way of the Cross,,,,Our Gospel Legacy: Easy Hymn Arrangements for Organ,,,,,,,,46,,Davis,,,
The Way of the Cross Leads Home,,,,,Way of the Cross,,,,Pull Out All the Stops Volume 3,,,,,,,,40,,Davis,,,
Thee We Adore,,,,,Adoro te Devote,,,,The Organist in Season: Autumn,,,,,,,,6,,Hebble,,,
There in God's Garden,,,,,Shades Mountain,,,,O God Beyond All Praising,,,,,,,,12,,Cherwien,,,
There in God's Garden,,,,,Shades Mountain,,,,Many and Great Hymn Settings for Organ,,,,,,,,24,,Farlee,,,
There Is a Balm in Gilead,,,,,Balm in Gilead,,,,Adoration,,,,,,,,21,,Lau,,,
There Is a Balm in Gilead,,,,,,,,,A Spiritual Service Based on African-American Spirituals,,,,,,,,6,,Inniss,,,
There is a Fountain ,,,,,Cleansing Fountain,,,,Best Ever Gospel Songs for Organ,,,,,,,,16,,Davidson,,,
There is a Fountain Filled With Blood,,,,,Cleansing Fountain,,,,Americana Organ Settings of Early American Hymns,,,,,,,,18,,Martin,,,
There Is a Green Hill Far Away,,,,,Green Hill,,,,"O Sacred Head: An Organ Collection for Palm Sunday, Holy Week and Easter",,,,,,,,18,,Warriner,,,Holy Week
There Is a Green Hill Far Away,,,,,Green Hill,,,,Communion Call-Meditations for Organ,,,,,,,,39,,Glyncannon,,,
There's a Wideness in God's Mercy,,,,,"Lord, Revive Us",,,,Many and Great Hymn Settings for Organ,,,,,,,,28,,Farlee,,,
They'll Know We Are Christians,,,,,St. Brendan's,,,,Easy Organ Library Vol 58,,,,,,,,22,,Leatherman,,,
Thine Forever! God of Love,,,,,Savannah,,,,The Parish Organist Part Twelve,,,,,,,,42,,Bouman,,,
Thine is the Glory,,,,,Judas Maccabeus,,,,Risen & Exalted An Eastertide Celebration for Organ,,,,,,,,6,,Smith,,,Easter
Thine is the Glory,,,,,Judas Maccabeus,,,,"O Sacred Head: An Organ Collection for Palm Sunday, Holy Week and Easter",,,,,,,,28,,Glyncannon,,,Easter
This Is My Father's World,,,,,Terra Beata,,,,The Organist in Season: Summer,,,,,,,,32,,Martin,,,Home
This Joyful Eastertide,,,,,Vruechten,,,,The Organist in Season: Spring,,,,,,,,36,,Wood,,,Easter
This Little Light of Mine,,,,,,,,,Spirituals and More for Organ,,,,,,,,4,,Rinehart,,,
"Thou Art the Way, to Thee Alone",,,,,St. James,,,,The Parish Organist Part Twelve,,,,,,,,30,,Krapf,,,
Though I May Speak,,,,,"O Waly, Waly",,,,Eight Hymn Preludes for Organ,,,,,,,,4,,Diemer,,,
Throned Upon the Awful Tree,,,,,Arfon,,,,Continuous Communion Meditations for Organ,,,,,,,,9,,Parker,,,Lent
"Thy Kingdom Come, O God!",,,,,St. Cecilia,,,,The Parish Organist Part Twelve,,,,,,,,18,,Boda,,,
Thy Table I Approach,,,,,St. Michael,,,,The Parish Organist Part Three,,,,,,,,21,,Bender,,,
Tis So Sweet to Trust in Jesus,,,,,Trust in Jesus,,,,The Everlasting Arms,,,,,,,,24,,Smith,,,
Tis So Sweet to Trust in Jesus,,,,,Trust in Jesus,,,,Our Gospel Legacy: Easy Hymn Arrangements for Organ,,,,,,,,31,,Smith,,,
TITLE,,,,,TUNE,,,,BOOK,,,,,,,,PAGE,,COMPOSER/ARRANGER,,,SEASON
To God All Glory Given,,,,,,,,,Pull Out All the Stops Volume 3,,,,,,,,10,,Sawyer,,,
To God Be the Glory,,,,,To God Be the Glory,,,,Easy Organ Library Vol 58,,,,,,,,48,,Johnson,,,
To God Be the Glory,,,,,To God Be the Glory,,,,All Hymns Bright and Beautiful,,,,,,,,16,,Parker,,,
To God Be the Glory,,,,,,,,,Best Ever Gospel Songs for Organ,,,,,,,,8,,Burkhardt,,,
To God Be the Glory,,,,,To God Be the Glory,,,,Our Gospel Legacy: Easy Hymn Arrangements for Organ,,,,,,,,12,,Parker,,,
To the Glory of God,,,,,,,,,Go Forth in Faith: Festive Music of Praise for Organ,,,,,,,,31,,Peterson,,,
Toccata Eroica,,,,,,,,,Pipe Dusters,,,,,,,,56,,Broughton,,,
Toccata for a Feast Day,,,,,,,,,Pipe Dusters,,,,,,,,41,,Smith,,,
Toccata for Easter Morning,,,,,Christ ist Erstanden,,,,The Organist in Season: Spring,,,,,,,,6,,Martin,,,Easter
Tranquil Waters,,,,,,,,,Chimings for Organ,,,,,,,,6,,Scriveyner,,,
Traumerei,,,,,,,,,Prelude to the Wedding for Organ,,,,,,,,12,,Schumann,,,
Triumphal March,,,,,,,,,"O Sacred Head: An Organ Collection for Palm Sunday, Holy Week and Easter",,,,,,,,4,,Turner,,,Palm Sun
Trumpet Finale,,,,,,,,,Baroque Music for Manuals,,,,,,,,27,,Albinoni,,,
Trumpet March,,,,,,,,,Baroque Music for Manuals,,,,,,,,5,,Clarke,,,
Trumpet Postlude,,,,,,,,,Pipe Dusters Vol 3,,,,,,,,30,,Koury,,,
Trumpet Tune,,,,,,,,,Adoration,,,,,,,,18,,Lau,,,
Trumpet Tune,,,,,,,,,Baroque Music for Manuals,,,,,,,,8,,Handel,,,
Trumpet Tune,,,,,,,,,Baroque Music for Manuals,,,,,,,,22,,Vivaldi,,,
Trumpet Tune,,,,,,,,,The Complete Wedding Collection,,,,,,,,58,,Clarke,,,
Trumpet Tune,,,,,,,,,God of Glory: Easy Festive Postludes for Organ,,,,,,,,44,,Harris,,,
Trumpet Tune,,,,,,,,,From This Day Forward,,,,,,,,62,,Clarke,,,
Trumpet Tune,,,,,,,,,Prelude to the Wedding for Organ,,,,,,,,19,,McCrory,,,
Trumpet Tune,,,,,,,,,The Parish Organist: Wedding Music,,,,,,,,11,,Purcell,,,
Trumpet Tune,,,,,,,,,The Parish Organist: Wedding Music,,,,,,,,16,,Purcell,,,
Trumpet Tune in C,,,,,,,,,Easy Organ Library Vol 58,,,,,,,,70,,Ryan,,,
Trumpet Voluntary,,,,,,,,,Old English Organ Music for Manuals Book 2,,,,,,,,8,,Goodwin,,,
Trumpet Voluntary,,,,,,,,,The Parish Organist: Wedding Music,,,,,,,,15,,Clarke,,,
Trumpet Voluntary in D,,,,,,,,,The Complete Wedding Collection II,,,,,,,,12,,Stanley,,,
Trumpet Voluntary-organ,,,,,,,,,From This Day Forward,,,,,,,,54,,Clarke,,,
Trumpet Voluntary-Prince of Denmark,,,,,,,,,The Complete Wedding Collection,,,,,,,,38,,Clarke,,,
Una Sancta,,,,,Una Sancta,,,,The Bristol Collection,,,,,,,,17,,Hancock,,,
Unto Us a Child Is Born,,,,,,,,,Pipe Dusters,,,,,,,,34,,Bach,,,
Up From the Grave He Arose,,,,,,,,,Three Nineteenth Century Revival Hymns,,,,,,,,16,,Ferguson,,,Easter
"Variants on ""St. Anne""",,,,,St. Anne,,,,Easy Organ Library Vol 58,,,,,,,,82,,Williamson,,,
Variations for Thanksgiving,,,,,,,,,The Complete Organist,,,,,,,,22,,Curtis,,,Thanksgiving
Variations on Old Hundredth,,,,,Old Hundredth,,,,The Bristol Collection,,,,,,,,27,,Hancock,,,
Veni Emmanuel Prelude,,,,,Veni Emmanuel,,,,The Organist in Season: Winter,,,,,,,,15,,Wyton,,,Avent
"Veni, Creator Spiritus Prelude",,,,,,,,,The Organist in Season: Spring,,,,,,,,46,,Wyton,,,Pentecost
Voluntary in A Minor,,,,,,,,,Old English Organ Music for Manuals Book 2,,,,,,,,4,,Boyce,,,
Voluntary in E Minor,,,,,,,,,Old English Organ Music for Manuals Book 2,,,,,,,,18,,Stanley,,,
Voluntary in G Minor,,,,,,,,,Old English Organ Music for Manuals Book 2,,,,,,,,12,,Roseingrave,,,
"Wake, Awake, for Night is Flying",,,,,Wachet Auf,,,,Six Preludes for the Church Year,,,,,,,,3,,Hobby,,,Advent
We Come to the Hungry Feast,,,,,Hungry Feast,,,,O God Beyond All Praising,,,,,,,,8,,Cherwien,,,
We Gather Together,,,,,Kremser,,,,The Complete Organist,,,,,,,,116,,Ritter,,,Thanksgiving
We Know that Christ Is Raised,,,,,Engelberg,,,,David Cherwien Hymn Interpretation Series: Holy Week & Easter,,,,,,,,14,,Cherwien,,,Easter
We Plow the Fields,,,,,Wir Pflugen,,,,The Complete Organist,,,,,,,,102,,Prentiss,,,Thanksgiving
We Plow the Fields,,,,,San Fernado,,,,Amen: World Hymns for Organ,,,,,,,,30,,Kerr,,,
We Plow the Fields and Scatter,,,,,Wir pflugen,,,,Praise and Thanksgiving Hymn Improvisations Set 7,,,,,,,,22,,Burkhardt,,,
"We PraiseYou, O God",,,,,Kremser,,,,The Organist in Season: Autumn,,,,,,,,32,,Wood,,,
We Shall Walk Through the Valley,,,,,Valley,,,,Fill the Earth With Music: Easy Music for Organ,,,,,,,,6,,Keyser,,,
We Three Kings,,,,,,,,,The Organ Music of Richard Purvis Three Christmas Preludes,,,,,,,,9,,Purvis,,,Epiphany
We Three Kings,,,,,Kings of Orient,,,,The Organist in Season: Winter,,,,,,,,45,,Haan,,,Epiphany
Wedding March from Midsummer Night's Dream,,,,,,,,,The Complete Wedding Collection,,,,,,,,46,,Mendelssohn,,,
Wedding March from Midsummer Night's Dream,,,,,,,,,From This Day Forward,,,,,,,,60,,Mendelssohn,,,
Wedlock,,,,,Wedlock,,,,Americana Organ Settings of Early American Hymns,,,,,Vol 2,,,14,,Martin,,,
"Welcome, Happy Morning!",,,,,Fortunatus,,,,Easter Glory! Festive Organ Music for the Season,,,,,,,,46,,Broughton,,,Easter
"Welcome,Happy Morning",,,,,Fortunatus,,,,Risen & Exalted An Eastertide Celebration for Organ,,,,,,,,15,,Smith,,,Easter
Wer nur den lieben Gott,,,,,Wer nur den lieben Gott,,,,"O Love, How Deep: Three Hymn Settings for Organ",,,,,,,,8,,Phillips,,,
We're Marching to Zion,,,,,,,,,Gospel Hymn Settings,,,,,,,,8,,Held,,,
Were You There,,,,,Were You There,,,,"Were You There: Easy Hymn Preludes for Palm Sunday, Holy Week, and Easter",,,,,,,,18,,Kerr,,,Good Friday
Were You There,,,,,Were You There,,,,Continuous Communion Meditations for Organ,,,,,,,,6,,Parker,,,Lent
Were You There,,,,,,,,,The Organist in Season: Spring,,,,,,,,21,,Martin,,,Holy Week
Westminster Abbey Voluntary,,,,,,,,,Voluntary on Westminster Abbey,,,,,,,,,,Purcell,,,
We've a Story to Tell,,,,,Message,,,,Our Gospel Legacy: Easy Hymn Arrangements for Organ,,,,,,,,25,,Turner,,,
What a Friend We Have in Jesus,,,,,Converse,,,,God With Us: Eleven Pieces for Organ,,,,,,,,27,,Diemer,,,
What a Friend We Have in Jesus,,,,,Converse,,,,Our Gospel Legacy: Easy Hymn Arrangements for Organ,,,,,,,,19,,Birchwood,,,
What a Friend We Have in Jesus,,,,,,,,,Softly and Tenderly: Organ Meditations on Well-Known Gospel Hymns,,,,,,,,11,,Wood,,,
What Wondrous Love is This,,,,,Wondrous Love,,,,An American Suite for Organ,,,,,,,,34,,Dahl,,,Lent
When Christ Was Born,,,,,Da Christus geboren war,,,,The Parish Organist Part Twelve,,,,,,,,66,,Koch,,,
When He Cometh,,,,,Jewels,,,,Nine Hymn Preludes for Organ,,,,,,,,18,,Young,,,
When I Survey the Wondrous Cross,,,,,Hamburg,,,,David Cherwien Hymn Interpretation Series: Holy Week & Easter,,,,,,,,9,,Cherwien,,,Good Friday
When I Survey the Wondrous Cross,,,,,Hamburg,,,,Continuous Communion Meditations for Organ,,,,,,,,3,,Parker,,,Lent
When I Survey the Wondrous Cross,,,,,Hamburg,,,,The Organist in Season: Spring,,,,,,,,40,,Whitworth,,,Holy Week
When I Survey the Wondrous Cross,,,,,Rockingham Old,,,,Six Preludes for the Church Year,,,,,,,,18,,Hobby,,,Lent
When the Roll Is Called Up Yonder,,,,,,,,,Blessed Assurance,,,,,,,,30,,Varner,,,
When the Roll Is Called Up Yonder,,,,,Roll Call,,,,Six Gospel Hymn Preludes,,,,,,,,12,,Held,,,
When Thou Art Near (Bist du bei mir),,,,,,,,,From This Day Forward,,,,,,,,20,,Bach,,,
When Twilight Comes,,,,,Dapit Hapon,,,,Amen: World Hymns for Organ,,,,,,,,33,,Kerr,,,
