title,,,,,hymn_tune_title,,,,book,,,,,,,,page_number,,composer,,,holiday
When We Are Living,,,,,Somas del Senor,,,,Eight Hymn Preludes for Organ,,,,,,,,18,,Diemer,,,
When You Woke That Thursday Morning,,,,,Joyous Light,,,,"Were You There: Easy Hymn Preludes for Palm Sunday, Holy Week, and Easter",,,,,,,,10,,Kerr,,,
Where Cross the Crowded Ways of Life,,,,,Germany,,,,Fill the Earth With Music: Easy Music for Organ,,,,,,,,25,,Keyser,,,
Where He Leads Me,,,,,Norris,,,,Come to the Alter,,,,,,,,18,,Smith,,,
Where'er You Walk from Semele,,,,,,,,,From This Day Forward,,,,,,,,34,,Handel,,,
Wherever I May Wander,,,,,New England,,,,Eight Hymn Preludes for Organ,,,,,,,,14,,Diemer,,,
While Shepherd Watched Their Flocks,,,,,,,,,Big Brown Book of Organ Solos,,,,,,,,97,,Griffin,,,
Whispering Hope,,,,,,,,,Blessed Be the Name,,,,,,,,29,,Hawthorne,,,
Who at My Door Is Standing,,,,,Everett,,,,Chimings for Organ,,,,,,,,42,,Broughton,,,
With Praises All Unite,,,,,,,,,Easy Organ Library Vol 58,,,,,,,,96,,Sweelinck,,,
With Reverence Let the Saints Appear,,,,,Reflection,,,,The Complete Organist,,,,,,,,75,,Smith,,,All Saints Da
With the Saints Glory Shining,,,,,,,,,Easy Organ Library Vol 58,,,,,,,,20,,Broughton,,,
Wonderful Words of Life,,,,,,,,,Gospel Hymn Settings,,,,,,,,14,,Held,,,
Wonderful Words of Life,,,,,Words of Life,,,,Fill the Earth With Music: Easy Music for Organ,,,,,,,,24,,Keyser,,,
Wonderful Words of Life,,,,,,,,,He Leadeth Me: Organ Solos,,,,,,,,13,,Whitworth,,,
"Word of God, Across the Ages",,,,,Austrian Hymn,,,,Go Forth in Faith: Festive Music of Praise for Organ,,,,,,,,40,,Smith,,,
Worthy of Worship,,,,,Judson,,,,Glad Adoration,,,,,,,,31,,Hamlin,,,
Ye Holy Angels Bright,,,,,Darwell,,,,Choral Preludes based on Famous Hymn Tunes Vol 5,,,,,,,,11,,Rowley,,,
Ye Holy Angels Bright,,,,,Darwall's 148th,,,,Pull Out All the Stops Volume 3,,,,,,,,19,,Ritter,,,
Ye Watchers and Ye Holy Ones,,,,,Lasst uns Erfreuen,,,,The Organist in Season: Summer,,,,,,,,3,,Krapf,,,Holy Trinity
You Are My Hiding Place,,,,,,,,,A Quiet Time in the Garden of Prayer,,,,,,,,23,,Caudill,,,
You Have Come Down to the Lakeshore,,,,,Pescador de Hombres,,,,Amen: World Hymns for Organ,,,,,,,,36,,Kerr,,,
You Have Come Down to the Lakeshore,,,,,Pescador de Hombres,,,,Many and Great Hymn Settings for Organ,,,,,,,,30,,Farlee,,,
"Oh, For a Thousand Tongues to Sing",,,,,Azmon,,,,Groundings,,,,,,,,2,,Cherwien,,,
I Want Jesus to Walk With Me,,,,,Sojourner,,,,Groundings,,,,,,,,5,,Cherwien,,,
"God, Who Stretched the Spangled Heavens",,,,,Holy Manna,,,,Groundings,,,,,,,,7,,Cherwien,,,
"Love Divine, All Loves Excelling",,,,,Hyfrydol,,,,Groundings,,,,,,,,14,,Cherwien,,,
"Come, Thou Fount of Every Blessing",,,,,Nettleton,,,,Groundings,,,,,,,,17,,Cherwien,,,
A Mighty Fortress Is Our God,,,,,Ein Feste Burg,,,,God of Grace,,,,,,,,5,,Manz,,,
Alleluia! Sing to Jesus,,,,,Hyfrydol,,,,God of Grace,,,,,,,,52,,Manz,,,
"Come, Thou Fount of Every Blessing",,,,,Nettleton,,,,God of Grace,,,,,,,,14,,Manz,,,
"Comfort, Comfort Now My People",,,,,Freu Dich Sehr,,,,God of Grace,,,,,,,,16,,Manz,,,
"Dearest Jesus, At Your Word",,,,,"Liebster Jesu, Wir Sind Hier",,,,God of Grace,,,,,,,,22,,Manz,,,
"Go, Tell It On the Mountain",,,,,Go Tell It,,,,God of Grace,,,,,,,,24,,Manz,,,
God of Grace,,,,,CWM RHONDDA,,,,God of Grace,,,,,,,,10,,Manz,,,
"Holy God, We Praise Your Name",,,,,Grosser Gott,,,,God of Grace,,,,,,,,26,,Manz,,,
How Lovely Shines the Morning Star,,,,,Wie Schon Leuchtet,,,,God of Grace,,,,,,,,28,,Manz,,,
Jesus Christ Is Risen Today,,,,,Easter Hymn,,,,God of Grace,,,,,,,,32,,Manz,,,
"Joyful, Joyful We Adore You",,,,,Hymn to Joy,,,,God of Grace,,,,,,,,34,,Manz,,,
"Love Divine, All Loves Excelling",,,,,Hyfrydol,,,,God of Grace,,,,,,,,52,,Manz,,,
"Now Sing We, Now Rejoice",,,,,In Dulci Jubilo,,,,God of Grace,,,,,,,,19,,Manz,,,
"O Sacred Head, Now Wounded",,,,,Herzlich TutMich Verlangen,,,,God of Grace,,,,,,,,56,,Manz,,,
"Oh, For a Thousand Tongues to Sing",,,,,Azmon,,,,God of Grace,,,,,,,,58,,Manz,,,
"Oh, that I Had a Thousand Voices",,,,,O Dass Ich Tausend Konig,,,,God of Grace,,,,,,,,"39, 42",,Manz,,,
"Praise to the Lord, the Almighty",,,,,LobeDen Herren,,,,God of Grace,,,,,,,,46,,Manz,,,
Twas in the Moon of Wintertime,,,,,Une Jeune Pucelle,,,,God of Grace,,,,,,,,60,,Manz,,,
"Wake, Awake, for Night is Flying",,,,,Wachet Auf,,,,God of Grace,,,,,,,,49,,Manz,,,
What Wondrous Love is This,,,,,Wondrous Love,,,,God of Grace,,,,,,,,62,,Manz,,,
Joy to the World,,,,,Antioch,,,,Go Out With JoyVol 2,,,,,,,,4,,McDonald,,,
Fanfare in F,,,,,,,,,Go Out With JoyVol 2,,,,,,,,9,,McDonald,,,
Song for All Saints,,,,,,,,,Go Out With JoyVol 2,,,,,,,,10,,McDonald,,,
Crown Him With Many Crowns,,,,,Diademata,,,,Go Out With JoyVol 2,,,,,,,,14,,McDonald,,,
The Star Spangled Banner,,,,,National Anthem,,,,Go Out With JoyVol 2,,,,,,,,19,,McDonald,,,
"Good Christians All, Rejoice",,,,,In Dulci Jubilo,,,,Go Out With JoyVol 2,,,,,,,,24,,McDonald,,,
Christ the Lord Is Risen Today,,,,,Easter Hymn,,,,Go Out With JoyVol 2,,,,,,,,28,,McDonald,,,
We Gather Together,,,,,Kresmer,,,,Go Out With JoyVol 2,,,,,,,,32,,McDonald,,,
Go Out With Joy!,,,,,,,,,Go Out With JoyVol 2,,,,,,,,36,,McDonald,,,
Fanfare in G,,,,,,,,,Go Out With JoyVol 2,,,,,,,,40,,McDonald,,,
"O Come, All Ye Faithful",,,,,Adeste Fideles,,,,Go Out With Joy,,,,,,,,4,,McDonald,,,
He Is Born,,,,,Il Est Ne,,,,Go Out With Joy,,,,,,,,8,,McDonald,,,
Another Year Is Dawning,,,,,Aurellia,,,,Go Out With Joy,,,,,,,,12,,McDonald,,,
"Come, Ye Faithful, Raise the Strain",,,,,St. Kevin,,,,Go Out With Joy,,,,,,,,16,,McDonald,,,
Crown Him Lord of All!,,,,,Diadem,,,,Go Out With Joy,,,,,,,,20,,McDonald,,,
God of Our Fathers,,,,,National Hymn,,,,Go Out With Joy,,,,,,,,24,,McDonald,,,
Mine Eyes HaveSeen the Glory,,,,,Battle Hymn,,,,Go Out With Joy,,,,,,,,28,,McDonald,,,
"Come, Ye Thankful People, Come",,,,,St. George's Windsor,,,,Go Out With Joy,,,,,,,,32,,McDonald,,,
In the Hour of Trial,,,,,Penitence,,,,Easy Organ Library Vol 51,,,,,,,,3,,Ritter,,,
Behold the Lamb of God,,,,,Wigan,,,,Easy Organ Library Vol 51,,,,,,,,6,,Smith,,,
Safe in His Arms,,,,,,,,,Easy Organ Library Vol 51,,,,,,,,9,,Birchwood,,,
I Want Jesus to Walk With Me,,,,,Walk With me,,,,Easy Organ Library Vol 51,,,,,,,,12,,Sewell,,,
Take Up Your Cross,,,,,Bourbon,,,,Easy Organ Library 51,,,,,,,,14,,Broughton,,,
Tumpet Tune,,,,,,,,,Easy Organ Library 51,,,,,,,,17,,McCrory,,,
The Garden Walk,,,,,,,,,Easy Organ Library 51,,,,,,,,20,,Davidson,,,
"Come, Ye Faithful, Raise the Strain",,,,,Ave Virgo Virginum,,,,Easy Organ Library 51,,,,,,,,23,,Peterson,,,
The Secret Place of the Most High,,,,,,,,,Easy Organ Library 51,,,,,,,,26,,Barnett,,,
Christ the Lord is Risen Again,,,,,Christ Ist Erstanden,,,,Easy Organ Library 51,,,,,,,,29,,Scott,,,
"Good Christians All, Rejoice and Sing",,,,,Gelobt Sei Gott,,,,Easy Organ Library 51,,,,,,,,32,,Paxton,,,
"O God, Our Help in Ages Past",,,,,St. Anne,,,,Easy Organ Library 51,,,,,,,,35,,Wilson,,,
Allegro Vivace from Water Music,,,,,,,,,Easy Organ Library 51,,,,,,,,38,,Handel,,,
Give Thanks Unto the Lord Our God,,,,,,,,,Easy Organ Library 51,,,,,,,,40,,Ritter,,,
Meditation on Galilee,,,,,Galilee,,,,Easy Organ Library 51,,,,,,,,43,,Mansfield,,,
Invocation,,,,,,,,,Easy Organ Library 51,,,,,,,,46,,Kihlken,,,
Only Trust Him,,,,,,,,,Easy Organ Library 51,,,,,,,,48,,Hughes,,,
O Gracious Lord,,,,,,,,,Easy Organ Library 51,,,,,,,,51,,Powell,,,
Loure,,,,,,,,,Easy Organ Library 51,,,,,,,,54,,Bach,,,
Poco Allegretto,,,,,,,,,Easy Organ Library 51,,,,,,,,56,,Brahms,,,
Grand Epilogue,,,,,,,,,Easy Organ Library 51,,,,,,,,59,,Broughton,,,
Holy Gifts We Offer,,,,,,,,,Easy Organ Library 51,,,,,,,,62,,Southbridg,,,
Arabesque in F,,,,,,,,,Easy Organ Library 51,,,,,,,,64,,Peterson,,,
First Touch of Dawn,,,,,,,,,Easy Organ Library 51,,,,,,,,67,,Broughton,,,
Prelude in Classic Style,,,,,,,,,Easy Organ Library 51,,,,,,,,70,,Young,,,
"O Savior Sweet, O Savior Kind",,,,,,,,,Easy Organ Library 51,,,,,,,,74,,Bach,,,
More Holiness Give Me,,,,,,,,,Easy Organ Library 51,,,,,,,,77,,Wilson,,,
Romanza,,,,,,,,,Easy Organ Library 51,,,,,,,,80,,Beethoven,,,
"Lead On, O King Eternal",,,,,Lancashire,,,,Easy Organ Library 51,,,,,,,,82,,Sewell,,,
But the Lord is Mindful of His Own,,,,,,,,,Easy Organ Library 51,,,,,,,,85,,Mendelssohn,,,
Fanfare and Trumpeting,,,,,,,,,Easy Organ Library 51,,,,,,,,88,,Paxton,,,
Berceuse,,,,,,,,,Easy Organ Library 51,,,,,,,,90,,Smith,,,
Mazurka in F Minor,,,,,,,,,Easy Organ Library 51,,,,,,,,93,,Chopin,,,
Lamentation,,,,,,,,,Easy Organ Library 51,,,,,,,,96,,Ritter,,,
"Come, Thou Fount of Every Blessing",,,,,,,,,The Essential Collection,,,,,,,,1,,Raney,,,
Let All Things Now Living,,,,,Ash Grove,,,,The Essential Collection,,,,,,,,6,,Larson,,,
Great Is They Faithfulness,,,,,,,,,The Essential Collection,,,,,,,,10,,Wagner,,,
When In Our Music God is Glorified,,,,,,,,,The Essential Collection,,,,,,,,14,,Wallace,,,
Glorious Things of Thee Are Spoken,,,,,,,,,The Essential Collection,,,,,,,,16,,Young,,,
Toccata,,,,,,,,,The Essential Collection,,,,,,,,18,,Wagner,,,
"Halle, Halle, Hallelujah",,,,,,,,,The Essential Collection,,,,,,,,23,,Behnke,,,
Lord of the Dance,,,,,Simple Gifts,,,,The Essential Collection,,,,,,,,28,,Wagner,,,
"Praise, My Soul, the King of Heaven",,,,,,,,,The Essential Collection,,,,,,,,32,,Hustad,,,
"Jesus, the Very Thought of Thee",,,,,,,,,The Essential Collection,,,,,,,,37,,Whitsett,,,
"Love Divine, All Loves Excelling",,,,,,,,,The Essential Collection,,,,,,,,40,,Raney,,,
"Spirit of God, Descend Upon My Heart",,,,,,,,,The Essential Collection,,,,,,,,46,,Hustad,,,
T,,,,,,,,,The Essential Collection,,,,,,,,48,,Lowenberg,,,
Just As I Am,,,,,,,,,The Essential Collection,,,,,,,,52,,Young,,,
It Is Well,,,,,,,,,The Essential Collection,,,,,,,,56,,Whitsett,,,
May the Mind of Christ My Saviour,,,,,,,,,The Essential Collection,,,,,,,,60,,Schrader,,,
Tis So Sweet to Trust in Jesus,,,,,,,,,The Essential Collection,,,,,,,,62,,Larson,,,
Away in a Manger,,,,,,,,,The Essential Collection,,,,,,,,65,,Wagner,,,Advent/Christmas
Sing We Now of Christmas,,,,,,,,,The Essential Collection,,,,,,,,68,,Wagner,,,Advent/Christmas
The First Noel ,,,,,,,,,The Essential Collection,,,,,,,,72,,Carter,,,Advent/Christmas
What Child Is This,,,,,,,,,The Essential Collection,,,,,,,,74,,Behnke,,,Advent/Christmas
"Good Christian Friends, Rejoice",,,,,,,,,The Essential Collection,,,,,,,,77,,Laubengaye,,,Advent/Christmas
"O Come, All Ye Faithful",,,,,Adeste Fidelis,,,,The Essential Collection,,,,,,,,80,,Behnke,,,Advent/Christmas
Angels We Have Heard On High,,,,,,,,,The Essential Collection,,,,,,,,82,,Shackley,,,Advent/Christmas
Joy to the World,,,,,Antioch,,,,The Essential Collection,,,,,,,,86,,Hustad,,,Advent/Christmas
"Hosanna, Loud Hosanna",,,,,,,,,The Essential Collection,,,,,,,,88,,Carter,,,Palm Sunday
Lead Me to Calvary,,,,,,,,,The Essential Collection,,,,,,,,91,,Whitsett,,,Holy Week
When I Survey the Wondrous Cross,,,,,,,,,The Essential Collection,,,,,,,,94,,Whitsett,,,Holy Week
"Jesu, Jesu Fill Us with Your Love",,,,,,,,,The Essential Collection,,,,,,,,97,,Powell,,,Holy Week
"O Sacred Head, Now Wounded",,,,,,,,,The Essential Collection,,,,,,,,100,,Hustad,,,Holy Week
"Ah, Holy Jesus",,,,,,,,,The Essential Collection,,,,,,,,102,,Ferguson,,,Holy Week
"Good Christians All, Rejoice and Sing",,,,,,,,,The Essential Collection,,,,,,,,103,,Holstein,,,Easter
Lift High the Cross,,,,,,,,,The Essential Collection,,,,,,,,107,,Shackley,,,Easter
Like the Murmur of the Dove's Song,,,,,,,,,The Essential Collection,,,,,,,,110,,Carter,,,Pentecost
A Mighty Fortress Is Our God,,,,,Ein Feste Burg,,,,The Essential Collection,,,,,,,,112,,Hustad,,,Reformation
We’re Marching to Zion,,,,,,,,,The Essential Collection,,,,,,,,120,,Young,,,All Saints
"O, When Shall I See Jesus?",,,,,,,,,The Essential Collection,,,,,,,,124,,Hustad,,,All Saints
Let Us Break Bread Together,,,,,,,,,The Essential Collection,,,,,,,,127,,Zabel,,,Communion
There Is a Fountain,,,,,,,,,The Essential Collection,,,,,,,,130,,Hustad,,,Communion
Now the Silence,,,,,,,,,The Essential Collection,,,,,,,,133,,Wallace,,,Communion
What Wondrous Love is This,,,,,,,,,The Essential Collection,,,,,,,,136,,Carter,,,Lent
Let Us Talents and Tongues Employ,,,,,,,,,The Essential Collection,,,,,,,,138,,Behnke,,,Communion
Hymn of Promise,,,,,,,,,The Essential Collection,,,,,,,,142,,Ferguson,,,Death
"Come, Thou Almight King",,,,,,,,,The Essential Collection,,,,,,,,144,,Hustad,,,
When He Cometh,,,,,,,,,The Essential Collection,,,,,,,,146,,Young,,,
Now Thank We All Our God,,,,,,,,,The Essential Collection,,,,,,,,148,,Behnke,,,Thanksgiving
Gigue,,,,,,,,,The Essential Collection,,,,,,,,150,,Wagner,,,Thanksgiving
"America, the Beautiful",,,,,,,,,The Essential Collection,,,,,,,,153,,Whitsett,,,Patriotic
"My Country, Tis of Thee",,,,,,,,,The Essential Collection,,,,,,,,156,,Whitsett,,,Patriotic
Reflection,,,,,,,,,The Essential Collection,,,,,,,,158,,Wagner,,,Wedding
The Gift of Love,,,,,,,,,The Essential Collection,,,,,,,,160,,Carter,,,Wedding
A Trumpet Fancy,,,,,,,,,The Essential Collection,,,,,,,,163,,Nelson,,,Wedding
Processional in C,,,,,,,,,The Essential Collection,,,,,,,,166,,Hopson,,,Wedding
Sheep May Safely Graze,,,,,,,,,The Essential Collection,,,,,,,,171,,Schrader,,,Wedding
S,,,,,,,,,The Essential Collection,,,,,,,,176,,Kellner,,,Wedding
Savior Like a Shepherd Lead us,,,,,Bradbury,,,,Quiet Preludes-Seven Favorite Hymns,,,,,,,,1,,Lau,,,
Just As I Am,,,,,Woodworth,,,,Quiet Preludes-Seven Favorite Hymns,,,,,,,,4,,Lau,,,
I Need Thee Every Hour,,,,,Lowry,,,,Quiet Preludes-Seven Favorite Hymns,,,,,,,,7,,Lau,,,
Amazing Grace,,,,,New Britain,,,,Quiet Preludes-Seven Favorite Hymns,,,,,,,,10,,Lau,,,
"Jesus, the Very Thought of Thee",,,,,St. Agnes,,,,Quiet Preludes-Seven Favorite Hymns,,,,,,,,14,,Lau,,,
"O Master, Let Me Walk with Thee",,,,,Maryton,,,,Quiet Preludes-Seven Favorite Hymns,,,,,,,,18,,Lau,,,
"Jesus, Savior, Pilot Me",,,,,Pilot,,,,Quiet Preludes-Seven Favorite Hymns,,,,,,,,22,,Lau,,,
I,,,,,Near the Cross,,,,Let Me Walk With Thee,,,,,,,,3,,Southbridge,,,
"My Jesus, I Love Thee",,,,,Gordon,,,,Let Me Walk With Thee,,,,,,,,8,,Southbridge,,,
"O Master, Let Me Walk with Thee",,,,,Maryton,,,,Let Me Walk With Thee,,,,,,,,12,,Southbridge,,,
"Savior, Thy Dying Love",,,,,Something for Jesus,,,,Let Me Walk With Thee,,,,,,,,16,,Southbridge,,,
Have Thine Own Way Lord,,,,,I Must Tell Jesus/Adelaide,,,,Let Me Walk With Thee,,,,,,,,20,,Southbridge,,,
He Leadeth Me!,,,,,He Leadeth Me/Bradbury,,,,Let Me Walk With Thee,,,,,,,,24,,Southbridge,,,
Must Jesus Bear the Cross Alone,,,,,Maitland,,,,Let Me Walk With Thee,,,,,,,,29,,Southbridge,,,
A Mighty Fortress Is Our God,,,,,Ein Feste Burg,,,,Hymns of Strength and Refuge,,,,,,,,3,,Smith,,,
The King of Love My Shepherd Is,,,,,St. Columbia,,,,Hymns of Strength and Refuge,,,,,,,,6,,Smith,,,
Give to the Winds Your Fears,,,,,Diademata,,,,Hymns of Strength and Refuge,,,,,,,,9,,Smith,,,
"Nearer, My  God to Thee",,,,,Bethany,,,,Hymns of Strength and Refuge,,,,,,,,12,,Smith,,,
"O God, Our Help in Ages Past",,,,,St. Anne,,,,Hymns of Strength and Refuge,,,,,,,,14,,Smith,,,
In Heavenly Love Abiding,,,,,Seasons,,,,Hymns of Strength and Refuge,,,,,,,,17,,Smith,,,
God is My Strong Salvation,,,,,Wedlock,,,,Hymns of Strength and Refuge,,,,,,,,20,,Smith,,,
He Leadeth Me!,,,,,He Leadeth Me,,,,Hymns of Strength and Refuge,,,,,,,,24,,Smith,,,
I to the Hills Lift Up Mine Eyes,,,,,Dundee,,,,Hymns of Strength and Refuge,,,,,,,,27,,Smith,,,
"Eternal Father, Strong to Save",,,,,Melita,,,,Hymns of Strength and Refuge,,,,,,,,30,,Smith,,,
Ellacombe,,,,,Ellacombe,,,,"Joyful, Joyful 6 Festive Preludes for Organ",,,,,,,,4,,Travis,,,
Hymn to Joy,,,,,Hymn to Joy,,,,"Joyful, Joyful 6 Festive Preludes for Organ",,,,,,,,8,,Travis,,,
Italian Hymn,,,,,Italian Hymn,,,,"Joyful, Joyful 6 Festive Preludes for Organ",,,,,,,,12,,Travis,,,
Llanfair,,,,,Llanfair,,,,"Joyful, Joyful 6 Festive Preludes for Organ",,,,,,,,16,,Travis,,,
Monkland,,,,,Monkland,,,,"Joyful, Joyful 6 Festive Preludes for Organ",,,,,,,,20,,Travis,,,
Nun danket all Gott,,,,,Nun danket all Gott,,,,"Joyful, Joyful 6 Festive Preludes for Organ",,,,,,,,24,,Travis,,,
"All Praise to Thee, My God, This Night",,,,,Tallis' Canon,,,,Improvisations on Great Hymns of Faith,,,,,,,,8,,Manz,,,
Be Thou My Vision,,,,,Slane,,,,Improvisations on Great Hymns of Faith,,,,,,,,14,,Manz,,,
Let All Mortal Flesh Keep Silent,,,,,Picardy,,,,Improvisations on Great Hymns of Faith,,,,,,,,10,,Manz,,,
Lift High the Cross,,,,,Crucifer,,,,Improvisations on Great Hymns of Faith,,,,,,,,16,,Manz,,,
"Love Divine, All Loves Excelling",,,,,Hyfrydol,,,,Improvisations on Great Hymns of Faith,,,,,,,,4,,Manz,,,
"O Love, How Deep",,,,,Deo Gracias,,,,Improvisations on Great Hymns of Faith,,,,,,,,18,,Manz,,,
Open Now Thy Gates of Beauty,,,,,Neander/Unser Herrscher,,,,Improvisations on Great Hymns of Faith,,,,,,,,20,,Manz,,,
Thy Strong Word,,,,,Ton-y-Botel,,,,Improvisations on Great Hymns of Faith,,,,,,,,12,,Manz,,,
"Abide with Us, Our Saviour",,,,,"Christus, der ist mein leben",,,,Improvisations on General Hymns,,,,,,,,23,,Manz,,,
All Depends on Our Possessing,,,,,Alles ist an Gottes Segen,,,,Improvisations on General Hymns,,,,,,,,18,,Manz,,,
Christians While on Earth Abiding,,,,,Werde munter,,,,Improvisations on General Hymns,,,,,,,,15,,Manz,,,
"Come, Thou Fount of Every Blessing",,,,,Nettleton,,,,Improvisations on General Hymns,,,,,,,,2,,Manz,,,
"God the Father, Be Our Stay",,,,,Gott der Vater wohn uns bei,,,,Improvisations on General Hymns,,,,,,,,12,,Manz,,,
"O Christ, Our Light, O Radiance True",,,,,"O Jesu Christe, wahres Licht",,,,Improvisations on General Hymns,,,,,,,,6,,Manz,,,
"O God, O Lord of Heaven and Earth",,,,,Wittenberg New,,,,Improvisations on General Hymns,,,,,,,,10,,Manz,,,
"Renew Me, O Eternal Light",,,,,"Herr Jesu Christ, meins",,,,Improvisations on General Hymns,,,,,,,,4,,Manz,,,
Your Table I Approach,,,,,"O Jesu Christe, wahres Licht",,,,Improvisations on General Hymns,,,,,,,,9,,Manz,,,
"Dearest Jesus, At Your Word",,,,,"Liebster Jesu, wir sind hier",,,,Improvisations on Classic Chorales,,,,,,,,2,,Manz,,,
If You But Trust in God to Guide You,,,,,Wer nur den lieben Gott,,,,Improvisations on Classic Chorales,,,,,,,,8,,Manz,,,
In You Is Gladness,,,,,In dir ist Freude,,,,Improvisations on Classic Chorales,,,,,,,,"4,6",,Manz,,,
"Jesus, Priceless Treasure",,,,,"Jesu, mein Freude",,,,Improvisations on Classic Chorales,,,,,,,,"16,20",,Manz,,,
Now Rest Beneath Night's Shadow,,,,,"O Welt, ich muss dich lassen",,,,Improvisations on Classic Chorales,,,,,,,,10,,Manz,,,
"O God, Thou Faithful God",,,,,"O Gott, du frommer Gott",,,,Improvisations on Classic Chorales,,,,,,,,25,,Manz,,,
"Our Father, Who from Heaven Above",,,,,Vater unser,,,,Improvisations on Classic Chorales,,,,,,,,"31,32",,Manz,,,
Soul Adorn Thyself with Gladness,,,,,Schmucke dich,,,,Improvisations on Classic Chorales,,,,,,,,14,,Manz,,,
What God Ordains Is Always Good,,,,,Was Gott Tut,,,,Improvisations on Classic Chorales,,,,,,,,28,,Manz,,,
All Hail the Power of Jesus' Name,,,,,Diadem,,,,If I Be Lifted Up,,,,,,,,3,,Martin,,,
Alleluia! Sing to Jesus!,,,,,Hyfrydolol,,,,If I Be Lifted Up,,,,,,,,9,,Sewell,,,
Christ the Lord Is Risen Today!,,,,,Llanfair,,,,If I Be Lifted Up,,,,,,,,12,,Smith,,,
"O Sacred Head, Now Wounded",,,,,,,,,If I Be Lifted Up,,,,,,,,16,,Bach,,,
Down at the Cross,,,,,Glory to His Name,,,,If I Be Lifted Up,,,,,,,,18,,Ritter,,,
"My Jesus, I Love Thee",,,,,Gordon,,,,If I Be Lifted Up,,,,,,,,20,,Spong,,,
Were You There,,,,,,,,,If I Be Lifted Up,,,,,,,,22,,Wood,,,Holy Week
Jesus is the Sweetest Name I Know,,,,,Lovely Name,,,,If I Be Lifted Up,,,,,,,,25,,Hughes,,,
Jesus Shall Reign,,,,,Duke Street,,,,If I Be Lifted Up,,,,,,,,28,,Paxton,,,
"Lead On, O King Eternal",,,,,Lancashire,,,,If I Be Lifted Up,,,,,,,,31,,Ritter,,,
Fairest Lord Jesus,,,,,Crusader's Hymn,,,,If I Be Lifted Up,,,,,,,,34,,Smith,,,
Christ for the World We Sing!,,,,,Italian Hymn,,,,I'll Praise My Maker,,,,,,,,3,,Smith,,,
"Guide Me, O Thou Great Jehovah",,,,,CWM RHONDDA,,,,I'll Praise My Maker,,,,,,,,6,,Paxton,,,
"Fantasia on ""Austrain Hymn""",,,,,Austrian Hymn,,,,I'll Praise My Maker,,,,,,,,10,,Paxton,,,
The Son of God Goes Forth,,,,,All Saints New,,,,I'll Praise My Maker,,,,,,,,14,,Paxton,,,
This Is My Father's World,,,,,Terra Beata,,,,I'll Praise My Maker,,,,,,,,17,,Hughes,,,
Diademata Improvisation,,,,,Diademata,,,,I'll Praise My Maker,,,,,,,,20,,Broughton,,,
"Praise to the Lord, the Almighty",,,,,Lobe Den Herren,,,,I'll Praise My Maker,,,,,,,,24,,Paxton,,,
St. Gertrude Postlude,,,,,St. Gertrude,,,,I'll Praise My Maker,,,,,,,,27,,Prentiss,,,
For All the Saints,,,,,Sine Nomine,,,,I'll Praise My Maker,,,,,,,,30,,Smith,,,
"Christ, Whose Glory Fills the Skies",,,,,Lux Prima,,,,I'll Praise My Maker,,,,,,,,34,,Koury,,,
"Joyful, Joyful We Adore Thee",,,,,Hymn to Joy,,,,I'll Praise My Maker,,,,,,,,37,,Broughton,,,
"O Zion, Haste",,,,,Angelic Songs,,,,I'll Praise My Maker,,,,,,,,40,,Smith,,,
To God Be the Glory,,,,,To God Be the Glory,,,,I'll Praise My Maker,,,,,,,,44,,Birchwood,,,
Blessed Be the Name,,,,,,,,,I Will Praise Him,,,,,,,,5,,Schubert,,,
Jesus Saves!,,,,,,,,,I Will Praise Him,,,,,,,,10,,Kirkpratrick,,,
Be Still My Soul,,,,,Finlandia,,,,I Will Praise Him,,,,,,,,14,,Sibelius,,,
The Love of God,,,,,,,,,I Will Praise Him,,,,,,,,18,,Lehman,,,
His Eye Is on the Sparrow,,,,,,,,,I Will Praise Him,,,,,,,,23,,Gabriel,,,
Such Love,,,,,,,,,I Will Praise Him,,,,,,,,28,,Harkness,,,
Day by Day,,,,,,,,,I Will Praise Him,,,,,,,,32,,Ahnfelt,,,
Grace Greater Than Our Sins,,,,,,,,,I Will Praise Him,,,,,,,,36,,Towner,,,
Praise Him! Praise Him!,,,,,,,,,I Will Praise Him,,,,,,,,41,,Allen,,,
I Will Praise Him,,,,,,,,,I Will Praise Him,,,,,,,,46,,Harris,,,
Higher Ground,,,,,,,,,I Will Praise Him,,,,,,,,50,,Gabriel,,,
"Saviour, Like a Shepherd Lead Us",,,,,Bradbury,,,,"I Am Thine, O Lord",,,,,,,,3,,Smith,,,
To God Be the Glory,,,,,To God Be the Glory,,,,"I Am Thine, O Lord",,,,,,,,6,,Burkhardt,,,
"Love Divine, All Loves Excelling",,,,,Beecher,,,,"I Am Thine, O Lord",,,,,,,,10,,Moore,,,
"I Am Thine, O Lord",,,,,"I Am Thine, O Lord",,,,"I Am Thine, O Lord",,,,,,,,12,,Prentiss,,,
O How I Love Jesus,,,,,O How I Love Jesus,,,,"I Am Thine, O Lord",,,,,,,,15,,Rasley,,,
"Breath on Me, Breath of God",,,,,Trentham,,,,"I Am Thine, O Lord",,,,,,,,18,,Bartlett,,,
See How Great a Flame Aspires,,,,,Arfon,,,,"I Am Thine, O Lord",,,,,,,,20,,Scriveyner,,,
Ye Watchers and Ye Holy Ones,,,,,Lasst uns Erfreuen,,,,"I Am Thine, O Lord",,,,,,,,23,,Smith,,,
All Hail the Power of Jesus' Name,,,,,Coronation,,,,"I Am Thine, O Lord",,,,,,,,26,,Birchwood,,,
O for a Thousand Tongues to Sing,,,,,Azmon,,,,"I Am Thine, O Lord",,,,,,,,28,,Birchwood,,,
"Make Me a Captive, Lord",,,,,Diademata,,,,"I Am Thine, O Lord",,,,,,,,31,,Turner,,,
I Have Decided to Follow Jesus,,,,,Assam,,,,"I Am Thine, O Lord",,,,,,,,34,,Howell,,,
St. Anne Variations,,,,,St. Anne,,,,"I Am Thine, O Lord",,,,,,,,37,,Broughton,,,
Duke Street Fantasia,,,,,Duke Street,,,,"I Am Thine, O Lord",,,,,,,,40,,Paxton,,,
For All the Saints,,,,,Sine Nomine,,,,"I Am Thine, O Lord",,,,,,,,43,,Smith,,,
"O Jesus, I Have Promised",,,,,Angel's Story,,,,"I Am Thine, O Lord",,,,,,,,46,,Ritter,,,
At the Lamb's High Feast We Sing,,,,,Sonne Der Gerechtigkeit,,,,This Wondrous Mystery,,,,,,,,20,,Kerr,,,Communion
Draw Near and Take the Body of the Lord,,,,,Old 124th,,,,This Wondrous Mystery,,,,,,,,12,,Kerr,,,Communion
Jesus Comes Today with Healing,,,,,Alles ist an Gottes segen,,,,This Wondrous Mystery,,,,,,,,8,,Kerr,,,Communion
"Now, My Tongue, the Mystery Telling",,,,,Grafton,,,,This Wondrous Mystery,,,,,,,,10,,Kerr,,,Communion
O Living Bread from Heaven,,,,,Ach Gott vom himmelreiche,,,,This Wondrous Mystery,,,,,,,,4,,Kerr,,,Communion
Sent Forth by God's Blessing,,,,,The Ash Grove,,,,This Wondrous Mystery,,,,,,,,24,,Kerr,,,Communion
Soul Adorn Thyself with Gladness,,,,,Schmucke dich,,,,This Wondrous Mystery,,,,,,,,17,,Kerr,,,Communion
"Thee We Adore, O Hidden Savior",,,,,Adoro te devote,,,,This Wondrous Mystery,,,,,,,,6,,Kerr,,,Communion
The Infant Priest Was Holy Born,,,,,Rockingham Old,,,,This Wondrous Mystery,,,,,,,,14,,Kerr,,,Communion
Your Table I Approach,,,,,St. Michael,,,,This Wondrous Mystery,,,,,,,,16,,Kerr,,,Communion
Abide With Me,,,,,Eventide,,,,Hymn Meditations for Organ,,,,,,,,4,,Krapf,,,
"Deck Yourself, My Soul, With Gladness",,,,,Schmucke Dich,,,,Hymn Meditations for Organ,,,,,,,,7,,Krapf,,,
Jesus Shall Reign,,,,,Duke Street,,,,Hymn Meditations for Organ,,,,,,,,10,,Krapf,,,
If You But Trust in God to Guide You,,,,,Wer Nur Den Lieben Gott,,,,Hymn Meditations for Organ,,,,,,,,12,,Krapf,,,
For All the Saints,,,,,Sine Nomine,,,,Hymn Meditations for Organ,,,,,,,,17,,Krapf,,,
"Jesus, Priceless Treasure",,,,,"Jesu, Meine Freude",,,,Hymn Meditations for Organ,,,,,,,,20,,Krapf,,,
"Renew Me, O Eternal Light",,,,,Christe Sanctorum,,,,Hymn Meditations for Organ,,,,,,,,25,,Krapf,,,
My Song is Love Unknown,,,,,Rhosymedre,,,,Hymn Meditations for Organ,,,,,,,,28,,Krapf,,,
What Wondrous Love is This,,,,,Wondrous Love,,,,Hymn Meditations for Organ,,,,,,,,30,,Krapf,,,
"My Soul, Now Praise Your Maker",,,,,"Nun Lob, Mein Seel",,,,Hymn Meditations for Organ Vol 4,,,,,,,,4,,Krapf,,,
"Praise, My Soul, the King of Heaven",,,,,Praise My Soul,,,,Hymn Meditations for Organ Vol 4,,,,,,,,10,,Krapf,,,
All Glory Be to God on High,,,,,Allein Gott in der Hoh,,,,Hymn Meditations for Organ Vol 4,,,,,,,,16,,Krapf,,,
O Worship the King,,,,,Hanover,,,,Hymn Meditations for Organ Vol 4,,,,,,,,23,,Krapf,,,
The God of Abraham Praise,,,,,Leoni,,,,Hymn Meditations for Organ Vol 4,,,,,,,,28,,Krapf,,,
Blessed Assurance,,,,,Assurance,,,,How Great Thou Art,,,,,,,,14,,Miller,,,
