title,,,,,hymn_tune_title,,,,book,,,,,,,,page_number,,composer,,,holiday
"Light of Lights, Lord of Lords",,,,,,,,,Go Forth in Faith: Festive Music of Praise for Organ,,,,,,,,12,,Birchwood,,,
Like the Murmur of the Dove's Song,,,,,Bridegroom,,,,Six Preludes for the Church Year,,,,,,,,24,,Hobby,,,Pentecost
Liverpool,,,,,Mercer's Cluster,,,,Americana Organ Settings of Early American Hymns,,,,,,,,8,,Martin,,,
Living for Christ,,,,,,,,,God of Glory: Easy Festive Postludes for Organ,,,,,,,,46,,Smith,,,
Lo! He Comes with Clouds Descending,,,,,St. Thomas,,,,The Parish Organist Part Twelve,,,,,,,,39,,Manz,,,
"Look, Ye Saints",,,,,Bryn Calfaria,,,,The Complete Organist,,,,,,,,80,,Chesterton,,,Ascension
"Lord Jesus Christ, My Life, My Light",,,,,"O Jesu Christ, mein's",,,,The Parish Organist Part Three,,,,,,,,24,,Bach,,,
"Lord Jesus, Think on Me",,,,,Southwell,,,,11 Compositions for Organ Set 5,,,,,,,,40,,Ore,,,
Lord of All Hopefulness,,,,,Slane,,,,Funeral Music for a Manuals,,,,,,,,7,,Callahan,,,Funeral
"Lord of All Hopefulness, Lord of All Joy",,,,,Slane,,,,The Parish Organist Part Twelve,,,,,,,,48,,Arnatt,,,
Lord of All Life,,,,,,,,,Go Forth in Faith: Festive Music of Praise for Organ,,,,,,,,6,,Broughton,,,
"Lord of Glory, You Have Brought Us",,,,,Hyfrydol,,,,11 Compositions for Organ Set 5,,,,,,,,38,,Ore,,,
"Lord, as to Thy Dear Cross We Flee",,,,,St. Bernard,,,,The Parish Organist Part Twelve,,,,,,,,14,,Busarow,,,
"Lord, Dismiss Us with Your Blessing",,,,,Sicilian Mariners,,,,Churchworks,,,,,,,,18,,Koch,,,
"Lord, Dismiss Us with Your Blessing",,,,,Sicilian Mariners,,,,The Parish Organist Part Twelve,,,,,,,,44,,Johnson,,,
"Lord, I Want to Be a Christian",,,,,I Want to Be a Christian,,,,Diane Bish Organ Book,,,,,,,,18,,Bish,,,
"Lord, Lift Me Up and Let Me Stand",,,,,Higher Ground,,,,Blessed Be the Name,,,,,,,,62,,Keeney,,,
"Lord, Revive Us",,,,,"Lord, Revive Us",,,,Americana Organ Settings of Early American Hymns,,,,,,,,24,,Martin,,,
"Lord, Speak to Me, That I May Speak",,,,,,,,,"Rejoice, the Lord Is King",,,,,,,,37,,Haan,,,
"Lord, Take My Hand and Lead Me",,,,,So Nimm Denn Meine Hande,,,,Six General Hymn Improvisations Set 2,,,,,,,,16,,Burkhardt,,,
"Lord, Teach Us How to Pray Aright",,,,,St. Hugh,,,,Choral Preludes based on Famous Hymn Tunes Vol 1 (Lent),,,,,,,,3,,Rowley,,,Lent
"Lord, when We Bend Before Thy Throne",,,,,St. Flavian,,,,The Parish Organist Part Twelve,,,,,,,,28,,Canning,,,
"Lord, Whose Love im Humble Service",,,,,Beach Spring,,,,David Cherwien Hymn Interpretation Series: Holy Week & Easter,,,,,,,,28,,Cherwien,,,Lent
"Lord, Why Have You Forsaken Me",,,,,Distress,,,,Americana Organ Settings of Early American Hymns,,,,,,,,27,,Martin,,,
"Lord's My Shepherd, I Shall Not Want",,,,,,,,,Prelude to the Wedding for Organ,,,,,,,,6,,Mansfield,,,
"Love Divine, All Love Excelling",,,,,Hyfrydol,,,,11 Compositions for Organ Set 5,,,,,,,,38,,Ore,,,
"Love Divine, All Loves Excelling",,,,,Hyfrydol,,,,Love Divine: Six Hymntunes on Wesley Texts,,,,,,,,4,,Burkhardt,,,
Love Lifted Me,,,,,Safety,,,,Blessed Be the Name,,,,,,,,36,,Smith,,,
"Love, Divine, All Love Excelling",,,,,O du Liebe,,,,The Parish Organist Part Three,,,,,,,,16,,Klotz,,,
Lyon 59,,,,,Lyon,,,,The Bristol Collection,,,,,,,,40,,Hancock,,,
Make Me a Channel of Your Peace,,,,,,,,,Sing a New Song,,,,,,,,19,,Wagner,,,
"Many and Great, O God, Are They Things",,,,,Lacquiparte,,,,Eight Hymn Preludes for Organ,,,,,,,,22,,Diemer,,,
"Many and Great, O God, Are Your Works",,,,,Lac Qui Parle,,,,Many and Great Hymn Settings for Organ,,,,,,,,20,,Farlee,,,
March from Occasional Oratorio,,,,,,,,,The Complete Wedding Collection II,,,,,,,,26,,Handel,,,
March from Richard the First,,,,,,,,,From This Day Forward,,,,,,,,68,,Handel,,,
March in D,,,,,,,,,The Complete Wedding Collection II,,,,,,,,28,,Purcell,,,
March Magnifique,,,,,,,,,From This Day Forward,,,,,,,,88,,Williams,,,
March Triumphant Into Jerusalem,,,,,,,,,Pipe Dusters,,,,,,,,13,,Thygerson,,,
Marche de Fete,,,,,,,,,Exaltation Festive Processionals for Organ,,,,,,,,9,,Wood,,,
Marching to Zion,,,,,,,,,Three Nineteenth Century Revival Hymns,,,,,,,,5,,Ferguson,,,
Materna,,,,,,,,,Eight Quiet Preludes on American Hymntunes,,,,,,,,10,,Callahan,,,
May Jesus Christ Be Praised,,,,,,,,,Big Brown Book of Organ Solos,,,,,,,,68,,Wyrtzen,,,
Meditation from Thais,,,,,,,,,The Complete Wedding Collection II,,,,,,,,39,,Massenet,,,
"Meditation on ""O store gud""",,,,,O Store Gud,,,,Easy Organ Library Vol 58,,,,,,,,68,,Wagner,,,
Meditation on Beach Spring,,,,,Beach Spring,,,,Chimings for Organ,,,,,,,,8,,Livingston,,,
Meditation on Gordon,,,,,Gordon,,,,Communion Call-Meditations for Organ,,,,,,,,8,,Peterson,,,
Meditation on O How I Love Jesus,,,,,,,,,Blessed Be the Name,,,,,,,,54,,Rasley,,,
Meditation on Veni Emmanuel,,,,,,,,,The Complete Organist,,,,,,,,32,,Scriveyner,,,Advent
Meditation Religieus,,,,,,,,,Chimings for Organ,,,,,,,,34,,Macklin,,,
Melodie,,,,,,,,,Chimings for Organ,,,,,,,,22,,Jansson,,,
Melodie,,,,,,,,,Prelude to the Wedding for Organ,,,,,,,,36,,Jansson,,,
Messiah Comes on Wings of Hope,,,,,Dove of Peace,,,,An American Suite for Organ,,,,,,,,27,,Dahl,,,
Midnight Stars Make Bright the Skies,,,,,Huan-sha-xi,,,,Amen: World Hymns for Organ,,,,,,,,22,,Kerr,,,
Moment by Moment,,,,,Whittle,,,,The Everlasting Arms,,,,,,,,15,,Smith,,,
More About Jesus,,,,,Sweney,,,,Footsteps of Jesus: Favorite Hymns and Gospel Songs for Organ,,,,,,,,30,,Smith,,,
More About Jesus,,,,,Sweney,,,,Our Gospel Legacy: Easy Hymn Arrangements for Organ,,,,,,,,40,,Kendall,,,
"More Love to Thee, O Christ",,,,,,,,,Chimings for Organ,,,,,,,,19,,Moore,,,
Morning Bells,,,,,,,,,Chimings for Organ,,,,,,,,10,,Smith,,,
Morning Has Broken,,,,,Bunessan,,,,Big Brown Book of Organ Solos,,,,,,,,10,,Boud,,,
Morning Has Broken,,,,,Bunessan,,,,Hymns for Organ: Artistic Expressions of Faith and Joy,,,,,,,,28,,Hayes,,,
Morning Has Broken,,,,,Bunessan,,,,Morning Has Broken: Three Quiet Hymn Settings for Worship,,,,,,,,3,,Langlois,,,
Morning Has Broken,,,,,Bunessan,,,,Prelude to the Wedding for Organ,,,,,,,,14,,Broughton,,,
Morning Song,,,,,Wyeth's Repository of Sacred Music,,,,Americana Organ Settings of Early American Hymns,,,,,,,,5,,Martin,,,
Morning Song,,,,,,,,,Chimings for Organ,,,,,,,,18,,McCrory,,,
"Mothering God, You Gave Me Birth",,,,,Norwich,,,,O God Beyond All Praising,,,,,,,,17,,Cherwien,,,
Musette,,,,,,,,,Baroque Music for Manuals,,,,,,,,6,,Handel,,,
"My Country, 'Tis of Thee",,,,,America,,,,The Complete Organist,,,,,,,,96,,Turner,,,Patriotic
My Faith Has Found a Resting Place,,,,,Norse Air,,,,Blessed Be the Name,,,,,,,,42,,Turner,,,
My Faith Looks Up To Thee,,,,,Olivet,,,,Fill the Earth With Music: Easy Music for Organ,,,,,,,,21,,Keyser,,,
My Faith Looks Up To Thee,,,,,Olivet,,,,The Organist in Season: Spring,,,,,,,,12,,Karvonen,,,Holy Week
My Faith Looks Up To Thee,,,,,,,,,Spirituals and More for Organ,,,,,,,,16,,Rinehart,,,
My Faith Looks Up To Thee,,,,,Olivet,,,,The Parish Organist Part Three,,,,,,,,30,,Arbatsky,,,
My Heart Ever Faithful,,,,,,,,,Prelude to the Wedding for Organ,,,,,,,,3,,Bach,,,
My Hope Is Built on Nothing Less,,,,,The Solid Rock,,,,Six Gospel Hymn Preludes,,,,,,,,17,,Held,,,
"My Jesus, I Love Thee",,,,,,,,,Blessed Assurance,,,,,,,,50,,Varner,,,
"My Jesus, I Love Thee",,,,,Gordon,,,,Diane Bish Organ Book,,,,,,,,25,,Bish,,,
My Shepherd Will Supply My Need,,,,,Resignation,,,,Hymns for Organ: Artistic Expressions of Faith and Joy,,,,,,,,8,,Hayes,,,
Near the Cross,,,,,Near the Cross,,,,"O Sacred Head: An Organ Collection for Palm Sunday, Holy Week and Easter",,,,,,,,21,,Ritter,,,Holy Week
Near the Cross,,,,,,,,,Organ Preludes on Hymns Old and New,,,,,,,,26,,Hustad,,,
Near the Cross,,,,,Near the Cross,,,,Our Gospel Legacy: Easy Hymn Arrangements for Organ,,,,,,,,37,,Ritter,,,
Near the Cross,,,,,,,,,A Quiet Time in the Garden of Prayer,,,,,,,,18,,Caudill,,,
Near to the Heart of God,,,,,,,,,He Leadeth Me: Organ Solos,,,,,,,,30,,Whitworth,,,
Nearer Medley,,,,,Near to the Heart of God,,,,Blessed Be the Name,,,,,,,,8,,Clarke,,,
"Nearer, My God to Thee",,,,,Bethany,,,,Diane Bish Organ Book,,,,,,,,12,,Bish,,,
"Nearer, My God to Thee",,,,,Horbury,,,,Choral Preludes based on Famous Hymn Tunes Vol 5,,,,,,,,7,,Rowley,,,
"Nearer, My God to Thee",,,,,Bethany,,,,Every Time I Feel the Spirit,,,,,,,,24,,Elliott,,,
"Nearer, Still Nearer",,,,,Morris,,,,Footsteps of Jesus: Favorite Hymns and Gospel Songs for Organ,,,,,,,,21,,Smith,,,
Nettleton (Sinner's Call),,,,,Nettleton,,,,The Bristol Collection,,,,,,,,5,,Hancock,,,
Neumark (Wer nur den Lieben Gott),,,,,Neumark,,,,The Bristol Collection,,,,,,,,37,,Hancock,,,
No Tramp of Soldiers' Marching Feet,,,,,Kingsfold,,,,"Were You There: Easy Hymn Preludes for Palm Sunday, Holy Week, and Easter",,,,,,,,8,,Kerr,,,Lent
No Wind at the Window,,,,,Columcille,,,,Festive Hymn Settings for Advent Christmas and Epiphany,,,,,,,,14,,Burkhardt,,,Advent
"No, Not One",,,,,No Not One,,,,Footsteps of Jesus: Favorite Hymns and Gospel Songs for Organ,,,,,,,,10,,Smith,,,
Nocturne from A Midsummer Night's Dream,,,,,,,,,From This Day Forward,,,,,,,,14,,Mendelssohn,,,
"Nocturne from Opus 9, No 2",,,,,,,,,Prelude to the Wedding for Organ,,,,,,,,46,,Chopin,,,
Noel Toccate,,,,,Noel Nouvelet,,,,The Organist in Season: Winter,,,,,,,,28,,Young,,,Christmas
Not All the Blood of Beasts,,,,,Southwell,,,,11 Compositions for Organ Set 5,,,,,,,,40,,Ore,,,
Now All the Vault of Heaven Resounds,,,,,Lasst uns Erfreuen,,,,Pipe Dusters Vol 3,,,,,,,,33,,Mansfield,,,
Now Herald We the King,,,,,,,,,Power and Praise: Festive Organ Music for the Service,,,,,,,,26,,Paxton,,,
Now Rest Beneath Night's Shadow,,,,,"O Welt, ich muss dich lassen",,,,The Parish Organist Part Three,,,,,,,,26,,Bach,,,
Now Thank We All Our God,,,,,Nun Danket Alle Gott,,,,The Complete Organist,,,,,,,,125,,Smith,,,Thanksgiving
Now Thank We All Our God,,,,,Nun Danket Alle Gott,,,,Churchworks,,,,,,,,20,,Koch,,,
Now Thank We All Our God,,,,,,,,,The Complete Wedding Collection,,,,,,,,54,,Karg-Elert,,,
Now Thank We All Our God,,,,,Nun Danket All Gott,,,,The Complete Wedding Collection II,,,,,,,,49,,Rembt,,,
Now Thank We All Our God,,,,,Nun Danket Alle Gott,,,,The Organist in Season: Autumn,,,,,,,,38,,Beverst,,,
Now Thank We All Our God,,,,,Nun danket,,,,Prelude to the Wedding for Organ,,,,,,,,43,,Hughes,,,
Now Thank We All Our God,,,,,Nun danket alle Gott,,,,The Parish Organist: Wedding Music,,,,,,,,32,,Bender,,,
Now Thank We All Our God from Cantata No. 79,,,,,Nun Danket All Gott,,,,The Complete Wedding Collection II,,,,,,,,5,,Bach,,,
"Now, On Land and Sea Descending",,,,,Vesper Hymn,,,,God With Us: Eleven Pieces for Organ,,,,,,,,14,,Diemer,,,
Nuptial Blessing,,,,,,,,,From This Day Forward,,,,,,,,38,,Batiste,,,
O Beautiful for Spacious Skies,,,,,Materna,,,,The Complete Organist,,,,,,,,78,,Broughton,,,Patriotic
O Blessed Holy Trinity,,,,,O heilige Dreifaltigkeit,,,,The Parish Organist Part Three,,,,,,,,22,,Bender,,,
"O Christ, Our Hope, Our Heart's Desire",,,,,,,,,"Rejoice, the Lord Is King",,,,,,,,16,,Haan,,,
"O Christ, Your Heart, Compassionate",,,,,Ellacombe,,,,Churchworks,,,,,,,,22,,Koch,,,
O Come and Mourn With Me Awhile,,,,,Kedron,,,,The Complete Organist,,,,,,,,82,,Morrison,,,Holy Week
"O Come, All Ye Faithful",,,,,,,,,Big Brown Book of Organ Solos,,,,,,,,102,,Torrans,,,
"O Come, O Come Emmanuel",,,,,Veni Emmanuel,,,,Festive Hymn Settings for Advent Christmas and Epiphany,,,,,,,,18,,Burkhardt,,,Advent
O Day of Peace,,,,,Jerusalem,,,,Many and Great Hymn Settings for Organ,,,,,,,,22,,Farlee,,,
O Day of Rest and Gladness,,,,,Woodbird,,,,The Parish Organist Part Twelve,,,,,,,,64,,Diercks,,,
O God Beyond All Praising,,,,,Thaxted,,,,O God Beyond All Praising,,,,,,,,2,,Cherwien,,,
O God in Heaven,,,,,Halad,,,,Amen: World Hymns for Organ,,,,,,,,24,,Kerr,,,
"O God, Our Help in Ages Past",,,,,St. Anne,,,,Funeral Music for a Manuals,,,,,,,,3,,Callahan,,,Funeral
"O God, Our Help in Ages Past",,,,,St. Anne,,,,Praise and Thanksgiving Hymn Improvisations Set 7,,,,,,,,15,,Burkhardt,,,
"O God, Our Help in Ages Past",,,,,St. Anne,,,,Power and Praise: Festive Organ Music for the Service,,,,,,,,43,,Bliss,,,
"O God, Our Help in Ages Past",,,,,St. Anne,,,,The Parish Organist Part Three,,,,,,,,40,,Miles,,,
"O God, Thou Faithful God",,,,,,,,,Gather in Praise: Ten Hymns of Praise for Organ,,,,,,,,15,,Broughton,,,
"O God, Thou Faithful God",,,,,"O Gott, du frommer Gott",,,,The Parish Organist Part Three,,,,,,,,18,,Walther,,,
"O Jesus, I Have Promised",,,,,Angel's Story,,,,God With Us: Eleven Pieces for Organ,,,,,,,,2,,Diemer,,,
O Little Town of Bethlehem,,,,,Forest Green,,,,Festive Hymn Settings for Advent Christmas and Epiphany,,,,,,,,50,,Burkhardt,,,Christmas
O Lord What a Mornin',,,,,,,,,Spirituals and More for Organ,,,,,,,,1,,Rinehart,,,
"O Lord, Turn Not Thy Face From Me",,,,,St. Mary,,,,Choral Preludes based on Famous Hymn Tunes Vol 1 (Lent),,,,,,,,7,,Rowley,,,Lent
O Love That Will Not Let Me Go,,,,,St. Margaret,,,,Favorite Hymns for Organ,,,,,,,,33,,Hebble,,,
O Love That Will Not Let Me Go,,,,,,,,,A Quiet Time in the Garden of Prayer,,,,,,,,13,,Caudill,,,
"O Master, Let Me Walk with Thee",,,,,Maryton,,,,The Organist in Season: Summer,,,,,,,,16,,Karvonen,,,Prayer
O Morning Star,,,,,Wie Schon Leuchtet,,,,The Complete Organist,,,,,,,,34,,Ritter,,,Epiphany
O Perfect Life of Love,,,,,Southwell,,,,The Parish Organist Part Three,,,,,,,,58,,Canning,,,
O Perfect Love,,,,,,,,,The Complete Wedding Collection,,,,,,,,35,,Linker,,,
O Perfect Love,,,,,,,,,From This Day Forward,,,,,,,,17,,Barnby,,,
"O Sacred Head, Now Wounded",,,,,Herzlich Tut Mich Verlangen,,,,"Were You There: Easy Hymn Preludes for Palm Sunday, Holy Week, and Easter",,,,,,,,14,,Kerr,,,Lent
"O Sacred Head, Now Wounded",,,,,Herzlich Tut Mich Verlangen,,,,"O Sacred Head: An Organ Collection for Palm Sunday, Holy Week and Easter",,,,,,,,27,,Garber,,,Holy Week
"O Sacred Head, Now Wounded",,,,,,,,,Big Brown Book of Organ Solos,,,,,,,,126,,Torrans,,,
"O Sacred Head, Now Wounded",,,,,,,,,Communion Call-Meditations for Organ,,,,,,,,6,,Pachelbel,,,Lent
"O Sacred Head, Now Wounded",,,,,,,,,Organ Preludes on Hymns Old and New,,,,,,,,30,,Hustad,,,
"O Sacred Head, Now Wounded",,,,,Passion Chorale,,,,The Organist in Season: Spring,,,,,,,,30,,Wyton,,,Holy Week
"O Saviour, Precious Savior",,,,,Watermouth,,,,The Parish Organist Part Twelve,,,,,,,,60,,Willan,,,
"O Saviour, Precious Savior",,,,,Angel's Story,,,,The Parish Organist Part Twelve,,,,,,,,60,,Willan,,,
O That Will Be Glory,,,,,Glory Song,,,,Best Ever Gospel Songs for Organ,,,,,,,,30,,Peterson,,,
O They Tell Me of a Home,,,,,The Uncloaded Day,,,,Blessed Be the Name,,,,,,,,44,,Moore,,,
"O Thou, In Whose Presence",,,,,Davis,,,,Americana Organ Settings of Early American Hymns,,,,,,,,14,,Martin,,,
O Where Are Kings and Empires Now,,,,,Tallis Ordinal,,,,The Parish Organist Part Twelve,,,,,,,,50,,Rohlig,,,
O Worship the King,,,,,,,,,Fanfare and Pageant of Praise,,,,,,,,10,,Hayden,,,
O Worship the King,,,,,,,,,He Leadeth Me: Organ Solos,,,,,,,,5,,Whitworth,,,
O Worship the King,,,,,Lyons,,,,Power and Praise: Festive Organ Music for the Service,,,,,,,,46,,Paxton,,,
O Worship the King Festal Prelude,,,,,Lyons,,,,Adoration,,,,,,,,3,,Lau,,,
"O Zion Haste, Thy Mission High Fulfilling",,,,,Tidings,,,,The Parish Organist Part Twelve,,,,,,,,52,,Olsen,,,
Ode to Life,,,,,,,,,Prelude to the Wedding for Organ,,,,,,,,28,,Wagner,,,
Of th Glorious Body Telling,,,,,Pange Lingua,,,,Churchworks,,,,,,,,32,,Koch,,,
Offertory on Maitland,,,,,Maitland,,,,Communion Call-Meditations for Organ,,,,,,,,28,,Broughton,,,
"Oft in Danger, Oft in Woe",,,,,University College,,,,The Parish Organist Part Twelve,,,,,,,,58,,Fetler,,,
"Oh, Bless the Lord, My Soul",,,,,St. Thomas,,,,The Parish Organist Part Three,,,,,,,,48,,Willan,,,
"Oh, Blest the House, Whate'er Befall",,,,,Wo Gott zum Haus,,,,The Parish Organist: Wedding Music,,,,,,,,31,,Jenne,,,
"Oh, For a Thousand Tongues to Sing",,,,,Azmon,,,,Churchworks,,,,,,,,24,,Koch,,,
"Oh, For a Thousand Tongues to Sing",,,,,Azmon,,,,Love Divine: Six Hymntunes on Wesley Texts,,,,,,,,23,,Burkhardt,,,
"Oh, For a Thousand Tongues to Sing",,,,,Azmon,,,,"Loud Praise to Christ, Our King! Festive Hymn Settings for Organ",,,,,,,,25,,Martin,,,
"Oh, that I Had a Thousand Voices",,,,,O dass ich tausend,,,,The Parish Organist Part Three,,,,,,,,12,,Metzger,,,
"Oh, that I Had a Thousand Voices",,,,,O dass ich tausend,,,,The Parish Organist Part Three,,,,,,,,14,,Reger,,,
"Oh, Worship the King",,,,,Lyons,,,,Ancient of Days 3 Hymns of Praise,,,,,,,,14,,Laubengaye,,,
Old 113th Festal Prelude,,,,,Old 113th,,,,Pipe Dusters,,,,,,,,29,,Martin,,,
Old Hundredth Variations,,,,,Old Hundredth,,,,Adoration,,,,,,,,9,,Lau,,,
On Christ the Solid Rock I Stand,,,,,Solid Rock,,,,Best Ever Gospel Songs for Organ,,,,,,,,3,,Mason,,,
On Christ the Solid Rock I Stand,,,,,Solid Rock,,,,Pull Out All the Stops Volume 3,,,,,,,,7,,Mason,,,
On Christmas Day in the Morn,,,,,The Holly and the Ivy,,,,Easy Organ Library Vol 58,,,,,,,,61,,Harris,,,Advent
On Eagle's Wings,,,,,,,,,Sing a New Song,,,,,,,,22,,Wagner,,,
On Jordan's Bank the Baptist's Cry,,,,,Puer Nobis Nascitur,,,,Festive Hymn Settings for Advent Christmas and Epiphany,,,,,,,,24,,Burkhardt,,,Advent
On Jordan's Stormy Banks I Stand,,,,,Promised Land,,,,Hymns for the Saints for Organ,,,,,,,,8,,Burkhardt,,,
On Our Way Rejoicing,,,,,Hermas,,,,Power and Praise: Festive Organ Music for the Service,,,,,,,,12,,Smith,,,
On This Day the Earth Shall Ring,,,,,Personet Hodie,,,,Six Preludes for the Church Year,,,,,,,,10,,Hobby,,,Christmas
Once to Every Man and Nation,,,,,Ebenezer,,,,Nine Hymn Preludes for Organ,,,,,,,,22,,Young,,,
Once We Sang and Danced,,,,,Kas Dziedaja,,,,Amen: World Hymns for Organ,,,,,,,,27,,Kerr,,,
Only Trust Him,,,,,Stockton,,,,Come to the Alter,,,,,,,,27,,Smith,,,
Only Trust Him,,,,,Stockton,,,,Close to Thee: Artistic Organ Settings of Eduring Gospel Songs,,,,,,,,29,,Southbridge,,,
Only Trust Him,,,,,Stockton,,,,Our Gospel Legacy: Easy Hymn Arrangements for Organ,,,,,,,,43,,Broughton,,,
Open My Eyes,,,,,Open My Eyes,,,,Blessed Be the Name,,,,,,,,15,,Hughes,,,
Our Christ Ascends,,,,,,,,,The Complete Organist,,,,,,,,72,,Kendall,,,Ascension
Our Christ Ascends,,,,,,,,,God of Glory: Easy Festive Postludes for Organ,,,,,,,,12,,Kendall,,,
"Our Father, Thou in Heaven Above",,,,,Vater unser,,,,The Parish Organist Part Three,,,,,,,,62,,Praetorius,,,
Our Great Saviour,,,,,,,,,Fanfare and Pageant of Praise,,,,,,,,29,,Wyrtzen,,,
"Pass Me Not, O Gentle Savior",,,,,Pass Me Not,,,,Blessed Be the Name,,,,,,,,18,,Smith,,,
"Pass Me Not, O Gentle Savior",,,,,Pass Me Not,,,,Chimings for Organ,,,,,,,,26,,Broughton,,,
Pastoral Symphony from Messiah,,,,,,,,,From This Day Forward,,,,,,,,40,,Handel,,,
Pastorale,,,,,,,,,The Complete Organist,,,,,,,,20,,Smith,,,Advent
Pastorale,,,,,,,,,Adoration,,,,,,,,24,,Lau,,,
Pastorale,,,,,,,,,Baroque Music for Manuals,,,,,,,,20,,Sammartini,,,
Pastorale,,,,,,,,,Old English Organ Music for Manuals Book 2,,,,,,,,20,,Hayes,,,
Pastorale on a Theme by Mendelssohn,,,,,,,,,Every Time I Feel the Spirit,,,,,,,,14,,Elliott,,,
Peace,,,,,Peace,,,,Americana Organ Settings of Early American Hymns,,,,,Vol 2,,,26,,Martin,,,
Peace to My Soul,,,,,,,,,The Complete Organist,,,,,,,,54,,Barnett,,,Lent
"People, Look East",,,,,Besancon,,,,The Organist in Season: Winter,,,,,,,,3,,Wood,,,Advent
Petite Promenade,,,,,,,,,Exaltation Festive Processionals for Organ,,,,,,,,25,,Wood,,,
Picardy Prelude,,,,,,,,,The Organist in Season: Winter,,,,,,,,18,,Martin,,,Advent
Pisgah,,,,,Pisgah,,,,Americana Organ Settings of Early American Hymns,,,,,Vol 2,,,6,,Martin,,,
Playford (Harmonia Sacra),,,,,Playford,,,,The Bristol Collection,,,,,,,,8,,Hancock,,,
Postlude in B-flat,,,,,,,,,Easy Organ Library Vol 58,,,,,,,,100,,Simper,,,
Postlude in C,,,,,,,,,Pipe Dusters Vol 3,,,,,,,,46,,Kihlken,,,
Postlude in G,,,,,,,,,Power and Praise: Festive Organ Music for the Service,,,,,,,,6,,Kihlken,,,
Postlude on Italian Hymn,,,,,,,,,The Complete Organist,,,,,,,,128,,Broughton,,,Holy Trinity
Praise and Thanksgiving,,,,,Bunessan,,,,Morning Has Broken: Three Quiet Hymn Settings for Worship,,,,,,,,3,,Langlois,,,
Praise God From Whom All Blessing Flow,,,,,Old 100th,,,,"Loud Praise to Christ, Our King! Festive Hymn Settings for Organ",,,,,,,,30,,Martin,,,
Praise God From Whom All Blessing Flow,,,,,Old Hundredth,,,,The Parish Organist Part Three,,,,,,,,7,,Bach,,,
Praise God in His Holy Temple,,,,,,,,,God of Glory: Easy Festive Postludes for Organ,,,,,,,,41,,Scott,,,
Praise Him With Trumpets,,,,,,,,,God of Glory: Easy Festive Postludes for Organ,,,,,,,,10,,Blake,,,
Praise Him! Praise Him!,,,,,Joyful Song,,,,Go Forth in Faith: Festive Music of Praise for Organ,,,,,,,,8,,Ritter,,,
Praise the Almighty,,,,,"Lobe Den Herren, O Meine Seele",,,,Praise and Thanksgiving Hymn Improvisations Set 3,,,,,,,,14,,Burkhardt,,,
Praise the Lord Who Reigns Above,,,,,Amsterdam,,,,Easy Organ Library Vol 58,,,,,,,,76,,Wagner,,,
"Praise the Lord! Ye Heavens, Adore Him",,,,,Hyfrydol,,,,All Hymns Bright and Beautiful,,,,,,,,27,,Blake,,,
"Praise the Lord! Ye Heavens, Adore Him",,,,,Hyfrydol,,,,Gather in Praise: Ten Hymns of Praise for Organ,,,,,,,,3,,Smith,,,
"Praise the Lord, Who Reigns Triumphant",,,,,,,,,Power and Praise: Festive Organ Music for the Service,,,,,,,,21,,Paxton,,,
"Praise to the Lord, the Almighty",,,,,Lobe Den Herren,,,,Diane Bish Organ Book,,,,,,,,20,,Bish,,,
"Praise to the Lord, the Almighty",,,,,,,,,The Complete Wedding Collection,,,,,,,,9,,Walther,,,
"Praise to the Lord, the Almighty",,,,,Lobe den Herren,,,,The Parish Organist Part Twelve,,,,,,,,5,,Zipp,,,
"Praise, My Soul, the King of Heaven",,,,,,,,,Big Brown Book of Organ Solos,,,,,,,,22,,Wyrtzen,,,
"Praise, My Soul, the King of Heaven",,,,,Lauda Anima,,,,Gather in Praise: Ten Hymns of Praise for Organ,,,,,,,,18,,Hughes,,,
Prayer,,,,,,,,,Chimings for Organ,,,,,,,,41,,Riggs,,,
Prayer,,,,,,,,,The Complete Wedding Collection II,,,,,,,,44,,Lemmens,,,
Prayer for Communion,,,,,,,,,Communion Call-Meditations for Organ,,,,,,,,30,,Livingston,,,
"Precious Lord, Take My Hand",,,,,Precious Lord,,,,God With Us: Eleven Pieces for Organ,,,,,,,,8,,Diemer,,,
"Precious Lord, Take My Hand",,,,,Precious Lord,,,,Six Gospel Hymn Preludes,,,,,,,,3,,Held,,,
"Precious Lord, Take My Hand",,,,,,,,,Spirituals and More for Organ,,,,,,,,10,,Rinehart,,,
Prelude in Classic Style,,,,,,,,,Prelude to the Wedding for Organ,,,,,,,,30,,Young,,,
Prelude in G,,,,,,,,,Old English Organ Music for Manuals Book 2,,,,,,,,21,,Linley,,,
"Prelude on ""St. Christopher""",,,,,St. Christopher,,,,Easy Organ Library Vol 58,,,,,,,,72,,Thygerson,,,
Prelude on Born Again,,,,,Born Again,,,,Blessed Be the Name,,,,,,,,57,,Keeney,,,
Prelude on Charlestown,,,,,Charlestown,,,,"O Sacred Head: An Organ Collection for Palm Sunday, Holy Week and Easter",,,,,,,,15,,Smith,,,Holy Week
Prelude on Cleansing Fountain,,,,,Cleansing Fountain,,,,Blessed Be the Name,,,,,,,,47,,Paxton,,,
Prelude on Ellacombe,,,,,Ellacombe,,,,"Come, Christians, Join to Sing",,,,,,,,4,,Harmon,,,
Prelude on Llanfair,,,,,Llanfair,,,,Easter Glory! Festive Organ Music for the Season,,,,,,,,34,,Smith,,,Easter
Prelude on Morning Star,,,,,,,,,The Complete Organist,,,,,,,,29,,Balcombe,,,Epiphany
Prelude on Spanish Hymn,,,,,Spanish Hymn,,,,"Come, Christians, Join to Sing",,,,,,,,8,,Harmon,,,
Prelude on St. Dunstan's,,,,,St. Dunstan's,,,,The Organist in Season: Autumn,,,,,,,,8,,Bock,,,
Prelude on Stuttgart,,,,,Stuttgart,,,,The Bristol Collection,,,,,,,,24,,Hancock,,,
Prelude on Terra Beata,,,,,Terra Beata,,,,"Come, Christians, Join to Sing",,,,,,,,18,,Harmon,,,
Prelude to Te Deum,,,,,,,,,From This Day Forward,,,,,,,,77,,Charpentier,,,
Preludeon Toplady,,,,,Toplady,,,,The Bristol Collection,,,,,,,,21,,Hancock,,,
Prepare the Royal Highway,,,,,Bereden vag for Herran,,,,11 Compositions for Organ Set 5,,,,,,,,8,,Ore,,,
Presence Diving,,,,,,,,,Chimings for Organ,,,,,,,,40,,Smith,,,
Priere a Notre-Dame,,,,,,,,,Easy Organ Library Vol 58,,,,,,,,64,,Boellman,,,
Priere a Notre-Dame from Suite Gothique,,,,,,,,,The Complete Wedding Collection,,,,,,,,20,,Boellmann,,,
Processional for a Joyful Day,,,,,,,,,Exaltation Festive Processionals for Organ,,,,,,,,21,,Wood,,,
Processional in G Major,,,,,,,,,The Complete Wedding Collection,,,,,,,,18,,Stanley,,,
Promised Land,,,,,Promised Land,,,,Americana Organ Settings of Early American Hymns,,,,,Vol 2,,,3,,Martin,,,
Prospect,,,,,Prospect,,,,Simple Gifs: Four American Hymn Preludes for Organ,,,,,,,,10,,Kosche,,,
Psalm 149,,,,,,,,,The Organist in Season: Autumn,,,,,,,,14,,Diemer,,,All Saints Day
Psalm 19,,,,,,,,,The Complete Wedding Collection,,,,,,,,24,,Marcello,,,
Psalm 19,,,,,,,,,From This Day Forward,,,,,,,,84,,Marcello,,,
Psalm 19,,,,,,,,,The Parish Organist: Wedding Music,,,,,,,,8,,Marcello,,,
Psalm 80,,,,,Psalm 42,,,,The Organist in Season: Winter,,,,,,,,6,,Diemer,,,Advent
Psalm of Glory,,,,,,,,,Pipe Dusters,,,,,,,,16,,Wells,,,
Puer Nobis Nascitur Variations,,,,,Puer Nobis Nascitur,,,,Favorite Hymns for Organ,,,,,,,,22,,Hebble,,,
Purer in Heart,,,,,,,,,Blessed Be the Name,,,,,,,,53,,Ritter,,,
Reflection on an Ancient Plainsong,,,,,Veni Emmanuel,,,,Easy Organ Library Vol 58,,,,,,,,42,,Ryan,,,
Reflections on O Store Gud,,,,,O Stor Gud,,,,Blessed Be the Name,,,,,,,,12,,Glyncannon,,,
Rejoice Ye Pure in Heart,,,,,,,,,Big Brown Book of Organ Solos,,,,,,,,44,,Torrans,,,
"Rejoice, the Lord Is King",,,,,Darwall's 148th,,,,Risen & Exalted An Eastertide Celebration for Organ,,,,,,,,24,,Smith,,,Ascension
"Rejoice, the Lord Is King",,,,,Darwall's 148th,,,,The Complete Organist,,,,,,,,42,,Mason,,,Ascension
"Rejoice, the Lord Is King",,,,,Darwell's 148th,,,,All Hymns Bright and Beautiful,,,,,,,,9,,Ritter,,,
