title,,,,,hymn_tune_title,,,,book,,,,,,,,page_number,,composer,,,holiday
"Holy, Holy, Holy! Lord God Almighty",,,,,,,,,Big Brown Book of Organ Solos,,,,,,,,64,,Wyrtzen,,,
A Day of Rejoicing,,,,,,,,,Go Forth in Faith: Festive Music of Praise for Organ,,,,,,,,16,,Smith,,,
A Joyous Acclamation,,,,,,,,,Pipe Dusters,,,,,,,,18,,Smith,,,
A Mighty Fortress Is Our God,,,,,Ein' Feste Burg,,,,The Complete Organist,,,,,,,,130,,Chesterton,,,Reformation
A Mighty Fortress Is Our God,,,,,Ein Feste Burg,,,,Diane Bish Organ Book,,,,,,,,30,,Bish,,,
A Mighty Fortress Is Our God,,,,,Ein' Feste Burg,,,,The Everlasting Arms,,,,,,,,30,,Smith,,,
A Mighty Fortress Is Our God,,,,,Ein Feste Burg,,,,The Organist in Season: Autumn,,,,,,,,28,,Young,,,
A Psalm of Trust,,,,,,,,,God of Glory: Easy Festive Postludes for Organ,,,,,,,,24,,Paxton,,,
A Resurrection Fanfare,,,,,,,,,Pipe Dusters Vol 3,,,,,,,,43,,Smith,,,Easter
A Tender Rose has Blossomed,,,,,Es Ist Ein Ros,,,,The Complete Organist,,,,,,,,11,,Rasley,,,Christmas
A Thanksgiving Offering,,,,,Kremser,,,,Churchworks,,,,,,,,30,,Koch,,,Thanksgivin
Abide With Me,,,,,Eventide,,,,Favorite Hymns for Organ,,,,,,,,6,,Hebble,,,
Abide With Me,,,,,Eventide,,,,Funeral Music for a Manuals,,,,,,,,11,,Callahan,,,Funeral
"Accept, O Lord, the Gifts We Bring",,,,,Barbara Allen,,,,O God Beyond All Praising,,,,,,,,6,,Cherwien,,,
According to Thy Gracious Word,,,,,Dundee,,,,The Complete Organist,,,,,,,,114,,Martin,,,Communion
Adagio,,,,,,,,,Baroque Music for Manuals,,,,,,,,12,,Corelli,,,
Adagio,,,,,,,,,Baroque Music for Manuals,,,,,,,,24,,Nardini,,,
Adagio,,,,,,,,,Baroque Music for Manuals,,,,,,,,25,,Albinoni,,,
Adagio,,,,,,,,,Old English Organ Music for Manuals Book 2,,,,,,,,10,,Bennett,,,
Adagio Molto from Third Sonata for Organ,,,,,,,,,The Complete Wedding Collection II,,,,,,,,36,,Guilmant,,,
Adeste Fideles Toccata,,,,,,,,,The Organist in Season: Winter,,,,,,,,20,,Hegarty,,,Christmas
Afro-Cuban,,,,,In dir ist Freude,,,,"Organ, Timbrel, and Dance",,,,,,,,12,,Michel,,,
"Ah, Holy Jesus",,,,,Herzliebster Jesu,,,,David Cherwien Hymn Interpretation Series: Holy Week & Easter,,,,,,,,12,,Cherwien,,,Lent
"Ah, Holy Jesus",,,,,Herzliebster Jesu,,,,Continuous Communion Meditations for Organ,,,,,,,,18,,Parker,,,Lent
Air en Echo,,,,,,,,,Baroque Music for Manuals,,,,,,,,11,,Lande,,,
Air from Water Music,,,,,,,,,From This Day Forward,,,,,,,,8,,Handel,,,
All Ceatures of Our God and King,,,,,Lasst uns erfreuen,,,,Five Preludes on Familiar Hymns for Organ,,,,,,,,16,,Hopson,,,
"All Creatures, Worship God Most High",,,,,Lasst Uns Erfreuen,,,,Churchworks,,,,,,,,4,,Koch,,,
All Easth Is Hopeful,,,,,Toda la tierra,,,,O God Beyond All Praising,,,,,,,,10,,Cherwien,,,
"All Glory, Laud and Honor",,,,,St. Theodulph,,,,"O Sacred Head: An Organ Collection for Palm Sunday, Holy Week and Easter",,,,,,,,6,,Smith,,,Holy Week
"All Glory, Laud and Honor",,,,,St. Theodulph,,,,The Complete Organist,,,,,,,,60,,Smith,,,Holy Week
"All Glory, Laud and Honor",,,,,St. Theodulph,,,,Pull Out All the Stops Volume 3,,,,,,,,4,,Smith,,,
"All Glory, Laud, and Honor",,,,,Valet will ich dir geben,,,,The Parish Organist Part Three,,,,,,,,60,,Kaufmann,,,
"All Glory, Laudh And Honor",,,,,St. Theodulph,,,,The Organist in Season: Spring,,,,,,,,4,,Southbridge,,,Palm Sunday
All Hail the Power of Jesus' Name,,,,,Coronation,,,,Risen & Exalted An Eastertide Celebration for Organ,,,,,,,,30,,Smith,,,Easter
All Hail the Power of Jesus' Name,,,,,Diadem,,,,All Hymns Bright and Beautiful,,,,,,,,20,,Sewell,,,
All Hail the Power of Jesus' Name,,,,,Diadem,,,,Big Brown Book of Organ Solos,,,,,,,,58,,Wyrtzen,,,
All Hail the Power of Jesus' Name,,,,,Diadem,,,,Diane Bish Organ Book,,,,,,,,35,,Bish,,,
All Hail the Power of Jesus' Name,,,,,Coronation,,,,Five Preludes on Familiar Hymns for Organ,,,,,,,,6,,Hopson,,,
All Hail the Power of Jesus' Name,,,,,,,,,Fanfare and Pageant of Praise,,,,,,,,50,,Wyrtzen,,,
All Now Sing Forth in Praise,,,,,,,,,Power and Praise: Festive Organ Music for the Service,,,,,,,,24,,Broughton,,,
All People That on Earth Do Dwell,,,,,Old Hundredth,,,,Easy Organ Library Vol 58,,,,,,,,94,,Broughton,,,General
"All Prise to Thee, My God, This Night",,,,,Tallis'Canon,,,,Six General Hymn Improvisations Set 2,,,,,,,,6,,Burkhardt,,,
All the Way My Saviour Leads Me,,,,,All the Way,,,,Close to Thee: Artistic Organ Settings of Eduring Gospel Songs,,,,,,,,8,,Southbridge,,,
All Things Bright and Beautiful,,,,,Royal Oaks,,,,All Hymns Bright and Beautiful,,,,,,,,3,,Smith,,,
All Things Bright and Beautiful,,,,,Royal Oak,,,,Gather in Praise: Ten Hymns of Praise for Organ,,,,,,,,12,,Mansfield,,,
All Things Bright and Beautiful,,,,,Royal Oak,,,,The Organist in Season: Summer,,,,,,,,42,,Wood,,,Home
"All Your Works of God, Bless the Lord",,,,,Linstead,,,,Amen: World Hymns for Organ,,,,,,,,18,,Kerr,,,
Allegretto,,,,,,,,,Baroque Music for Manuals,,,,,,,,14,,Purcell,,,
Allegro Maestoso from Water Music,,,,,,,,,The Complete Wedding Collection,,,,,,,,48,,Handel,,,
Allegro Maestoso from Water Music,,,,,,,,,From This Day Forward,,,,,,,,65,,Handel,,,
Alleluia! Let Praises Ring,,,,,Wie schoen leuchtet,,,,The Parish Organist: Wedding Music,,,,,,,,26,,Bender,,,
Alleluia! Sing to Jesus,,,,,Hyfrydol,,,,David Cherwien Hymn Interpretation Series: Holy Week & Easter,,,,,,,,18,,Cherwien,,,
"Alleluia, Alleluia",,,,,,,,,Big Brown Book of Organ Solos,,,,,,,,75,,Torrans,,,
"Alleluia, Lord Most High",,,,,Picardy,,,,Easy Organ Library Vol 58,,,,,,,,58,,Taylor,,,
"Alleluia, Song of Gladness",,,,,Dulce Carmen,,,,The Organist in Season: Winter,,,,,,,,42,,Powell,,,General
Amazing Grace,,,,,New Britain,,,,An American Suite for Organ,,,,,,,,4,,Dahl,,,
Amazing Grace,,,,,,,,,Blessed Assurance,,,,,,,,4,,Varner,,,
Amazing Grace,,,,,Amazing Grace,,,,Diane Bish Organ Book,,,,,,,,2,,Bish,,,
Amazing Grace,,,,,Amazing Grace,,,,Chimings for Organ,,,,,,,,36,,Broughton,,,
Amazing Grace,,,,,New Britain,,,,God With Us: Eleven Pieces for Organ,,,,,,,,11,,Diemer,,,
Amazing Grace,,,,,,,,,Five Preludes on Familiar Hymns for Organ,,,,,,,,3,,Hopson,,,
Amazing Grace,,,,,New Britain,,,,Funeral Music for a Manuals,,,,,,,,4,,Callahan,,,Funeral
Amazing Grace! How Sweet the Sound,,,,,New Britain,,,,Hymns for Organ: Artistic Expressions of Faith and Joy,,,,,,,,14,,Hayes,,,
"Amen, We Praise Your Name",,,,,Amen Siakudumisa,,,,Amen: World Hymns for Organ,,,,,,,,4,,Kerr,,,
America the Beautiful Fantasia,,,,,,,,,Pipe Dusters,,,,,,,,46,,Koury,,Patriotic,
America Variations,,,,,,,,,The Organist in Season: Summer,,,,,,,,21,,Lovelace,,,Patriotic
An Easter Fanfare,,,,,,,,,Easter Glory! Festive Organ Music for the Season,,,,,,,,6,,Paxton,,,Easter
Ancient of Days,,,,,Albany,,,,Power and Praise: Festive Organ Music for the Service,,,,,,,,9,,Chesterton,,,
And Can It Be?,,,,,,,,,Fanfare and Pageant of Praise,,,,,,,,38,,Wyrtzen,,,
"And Wilt Thou Pardon, Lord",,,,,St. Bride,,,,The Parish Organist Part Twelve,,,,,,,,16,,Beck,,,
Andante,,,,,,,,,Baroque Music for Manuals,,,,,,,,18,,Telemann,,,
Andante,,,,,,,,,Old English Organ Music for Manuals Book 2,,,,,,,,16,,Greene,,,
Andante Cantabile from Symphony No 5,,,,,,,,,Prelude to the Wedding for Organ,,,,,,,,8,,Tchaikovsky,,,
Andantino from Rosamunde,,,,,,,,,From This Day Forward,,,,,,,,10,,Schubert,,,
Angels From the Realms of Glory,,,,,Regent Square,,,,The Parish Organist Part Three,,,,,,,,36,,Unkel,,,Christmas
"Angels, from the Realms of Glory",,,,,,,,,Big Brown Book of Organ Solos,,,,,,,,113,,Torrans,,,
"Antiphonal Paraphrase on ""Lobe den Herren""",,,,,,,,,The Organist in Season: Summer,,,,,,,,12,,Wehr,,,General Praise
Are Ye Able Said the Master,,,,,Beacon Hill,,,,Blessed Be the Name,,,,,,,,50,,Bartlett,,,
Arfon Prelude,,,,,Arfon,,,,The Organist in Season: Spring,,,,,,,,32,,Haan,,,Holy Week
Arioso from Cantat No. 156,,,,,,,,,From This Day Forward,,,,,,,,5,,Bach,,,
Arioso from Cantata 156,,,,,,,,,The Complete Wedding Collection,,,,,,,,5,,Bach,,,
Arise to Life,,,,,,,,,Go Forth in Faith: Festive Music of Praise for Organ,,,,,,,,37,,Broughton,,,
As the Deer,,,,,,,,,A Quiet Time in the Garden of Prayer,,,,,,,,2,,Caudill,,,
As With Gladness Men of Old,,,,,Dix,,,,Festive Hymn Settings for Advent Christmas and Epiphany,,,,,,,,64,,Burkhardt,,,Epiphany
At Length There Dawns the Glorious Day,,,,,St. Michel's,,,,Pull Out All the Stops Volume 3,,,,,,,,37,,Mansfield,,,
At the Lamb's High Feast We Sing,,,,,Salzburg,,,,The Parish Organist Part Twelve,,,,,,,,40,,Schultz,,,
At the Name of Jesus,,,,,King's Weston,,,,Praise and Thanksgiving Hymn Improvisations Set 3,,,,,,,,6,,Burkhardt,,,
At the Worship Hour,,,,,,,,,Chimings for Organ,,,,,,,,24,,Ritter,,,
Ave Maria,,,,,,,,,The Complete Wedding Collection II,,,,,,,,60,,Bach-Gounod,,,
Ave Maria,,,,,,,,,The Complete Wedding Collection II,,,,,,,,58,,Schubert,,,
Awake! The Dawn Appears!,,,,,,,,,Easter Glory! Festive Organ Music for the Season,,,,,,,,38,,Scott,,,Easter
Awake! The Dawn Appears!,,,,,,,,,Power and Praise: Festive Organ Music for the Service,,,,,,,,16,,Scott,,,
"Awake, My Soul, and with the Sun",,,,,Morning Hymn,,,,Six General Hymn Improvisations Set 2,,,,,,,,6,,Burkhardt,,,
"Awake, Thou Wintry Earth",,,,,Vruechten,,,,The Complete Organist,,,,,,,,37,,Birchwood,,,Lent
Away in a Manger,,,,,Mueller,,,,Festive Hymn Settings for Advent Christmas and Epiphany,,,,,,,,28,,Burkhardt,,,Christmas
Be Known to Us in Breaking Bread,,,,,St. Flavian,,,,Continuous Communion Meditations for Organ,,,,,,,,16,,Parker,,,Lent
Be Not Afraid,,,,,,,,,Sing a New Song,,,,,,,,1,,Wagner,,,
"Be Still, My Soul",,,,,,,,,He Leadeth Me: Organ Solos,,,,,,,,23,,Whitworth,,,
Be Thou My Vision,,,,,,,,,Big Brown Book of Organ Solos,,,,,,,,6,,Wyrtzen,,,
Be Thou My Vision,,,,,Slane,,,,God With Us: Eleven Pieces for Organ,,,,,,,,20,,Diemer,,,
Be Thou My Vision,,,,,Slane,,,,Five Preludes on Familiar Hymns for Organ,,,,,,,,12,,Hopson,,,
Be Thou My Vision,,,,,Slane,,,,Favorite Hymns for Organ,,,,,,,,10,,Hebble,,,
Be Thou My Vision,,,,,Slane,,,,Fanfare and Pageant of Praise,,,,,,,,16,,Wyrtzen,,,
Be Thou My Vision,,,,,,,,,"Rejoice, the Lord Is King",,,,,,,,22,,Haan,,,
Be Thou My Vision,,,,,Slane,,,,Prelude to the Wedding for Organ,,,,,,,,34,,Broughton,,,
Be Thou My Vision,,,,,Slane,,,,The Parish Organist Part Twelve,,,,,,,,48,,Arnatt,,,
Beach Spring,,,,,Beach Spring,,,,Americana Organ Settings of Early American Hymns,,,,,,,,30,,Martin,,,
Beach Spring,,,,,Beach Spring,,,,Simple Gifs: Four American Hymn Preludes for Organ,,,,,,,,6,,Kosche,,,
Beautiful Savior,,,,,Schonster herr Jesu,,,,Gather in Praise: Ten Hymns of Praise for Organ,,,,,,,,21,,Smith,,,
Beautiful Savior,,,,,Schoenster Herr Jesu,,,,The Parish Organist Part Three,,,,,,,,50,,Arbatsky,,,
Beecher,,,,,Beecher,,,,Eight Quiet Preludes on American Hymntunes,,,,,,,,15,,Callahan,,,
"Before Thy Throne, O God, We Kneel",,,,,St. Petersburg,,,,The Parish Organist Part Twelve,,,,,,,,36,,Wienhorst,,,
"Begone, Unbelief",,,,,"Begone, Unbelief",,,,Americana Organ Settings of Early American Hymns,,,,,Vol 2,,,18,,Martin,,,
Behold the King!,,,,,,,,,"O Sacred Head: An Organ Collection for Palm Sunday, Holy Week and Easter",,,,,,,,38,,Smith,,,Easter
Behold the Saviour of Mankind,,,,,Windsor,,,,The Parish Organist Part Twelve,,,,,,,,62,,Willan,,,
Bells at Dusk,,,,,,,,,Chimings for Organ,,,,,,,,44,,Birchwood,,,
Belmont,,,,,Belmont,,,,Choral Preludes based on Famous Hymn Tunes Vol 5,,,,,,,,3,,Rowley,,,
Beneath the Cross of Jesus,,,,,St. Christopher,,,,Come to the Alter,,,,,,,,3,,Smith,,,
Beneath the Cross of Jesus,,,,,St. Christopher,,,,Continuous Communion Meditations for Organ,,,,,,,,12,,Parker,,,Lent
Beneath the Cross of Jesus,,,,,,,,,Organ Preludes on Hymns Old and New,,,,,,,,19,,Hustad,,,
"Bless Us Now, Dear Lord, We Pray",,,,,,,,,The Complete Organist,,,,,,,,84,,Moore,,,Lent
Blessed Assurance,,,,,,,,,Blessed Assurance,,,,,,,,10,,Varner,,,
Blessed Assurance,,,,,Assurance,,,,Eight Quiet Preludes on American Hymntunes,,,,,,,,4,,Callahan,,,
Blessed Assurance,,,,,Assurance,,,,The Everlasting Arms,,,,,,,,9,,Smith,,,
Blessed Assurance,,,,,,,,,A Quiet Time in the Garden of Prayer,,,,,,,,13,,Caudill,,,
Blessed Bethe Name,,,,,Blessed Name,,,,Blessed Be the Name,,,,,,,,3,,Glyncannon,,,
"Blessed Jesus, at Your Word",,,,,Liebster Jesu,,,,Easy Organ Library Vol 58,,,,,,,,8,,Leatherman,,,
Blest Be the Tie That Binds,,,,,Dennis,,,,Nine Hymn Preludes for Organ,,,,,,,,20,,Young,,,
Bonner,,,,,Bonner,,,,Hymns for Organ: Artistic Expressions of Faith and Joy,,,,,,,,18,,Hayes,,,
Bossa Nova,,,,,Wunderbarer Konig,,,,"Organ, Timbrel, and Dance",,,,,,,,8,,Michel,,,
Bread of the World in Mercy Broken,,,,,Eucharistic Hymn,,,,Communion Call-Meditations for Organ,,,,,,,,3,,Mansfield,,,
Bread of the World in Mercy Broken,,,,,Rendez a Dieu,,,,The Organist in Season: Summer,,,,,,,,37,,Diemer,,,Communion
"Bread of the World, in Mercy Broken",,,,,Rendez a Dieu,,,,The Parish Organist Part Twelve,,,,,,,,11,,Beyer,,,
"Breathe on Me, Breath of God",,,,,Trentham,,,,Churchworks,,,,,,,,6,,Koch,,,
"Brethren, We Have Met to Worship",,,,,Holy Manna,,,,Glad Adoration,,,,,,,,22,,Hamlin,,,
Bridal Chorus from Lohengrin,,,,,,,,,The Complete Wedding Collection,,,,,,,,43,,Wagner,,,
Bridal Chorus from Lohengrin,,,,,,,,,From This Day Forward,,,,,,,,52,,Wagner,,,
"Bring a Torch, Jeannette Isabella",,,,,,,,,Big Brown Book of Organ Solos,,,,,,,,108,,Griffin,,,
Brother James' Air,,,,,,,,,The Organist in Season: Summer,,,,,,,,45,,Martin,,,General
Built on a Rock,,,,,Kirken,,,,The Organist in Season: Autumn,,,,,,,,43,,Martin,,,
Built on the Rock,,,,,Kirken,,,,The Everlasting Arms,,,,,,,,18,,Smith,,,
Built on the Rock,,,,,Kirken,,,,Nine Hymn Preludes for Organ,,,,,,,,14,,Young,,,
By the Babylonian River,,,,,Kas Dziedaja,,,,Amen: World Hymns for Organ,,,,,,,,27,,Kerr,,,
Canon in D,,,,,,,,,The Complete Wedding Collection,,,,,,,,27,,Pachelbel,,,
Canon in D,,,,,,,,,From This Day Forward,,,,,,,,26,,Pachelbel,,,
Cantilena,,,,,,,,,Adoration,,,,,,,,15,,Lau,,,
Carols Sing,,,,,Bethlehem Song,,,,Fill the Earth With Music: Easy Music for Organ,,,,,,,,16,,Keyser,,,Christmas
Cavatina,,,,,,,,,Prelude to the Wedding for Organ,,,,,,,,38,,Bohm,,,
Celebration for Trumpet,,,,,,,,,God of Glory: Easy Festive Postludes for Organ,,,,,,,,32,,Thygerson,,,
Ceremonial March,,,,,,,,,Power and Praise: Festive Organ Music for the Service,,,,,,,,32,,Koury,,,
Chapel Bells at Sunrise,,,,,,,,,Chimings for Organ,,,,,,,,14,,Peterson,,,
Chapel Chimes,,,,,,,,,Chimings for Organ,,,,,,,,32,,Paxton,,,
Children of the Heavenly Father,,,,,Tryggare Kan Ingen Vara,,,,Adoration,,,,,,,,26,,Lau,,,
Children of the Heavenly Father,,,,,,,,,Organ Preludes on Hymns Old and New,,,,,,,,6,,Hustad,,,
Children of the Heavenly Father,,,,,,,,,"Rejoice, the Lord Is King",,,,,,,,30,,Haan,,,
Children's Song Medley,,,,,,,,,Hymns for Organ: Artistic Expressions of Faith and Joy,,,,,,,,18,,Hayes,,,
Chimings,,,,,,,,,Chimings for Organ,,,,,,,,3,,Thurman,,,
Choral Song,,,,,,,,,The Complete Wedding Collection II,,,,,,,,32,,Wesley,,,
Chorale Prelude on Duke Street,,,,,Duke Street,,,,The Organist in Season: Summer,,,,,,,,18,,Powell,,,Praise
Chorale Prelude on Spohr,,,,,Spohr,,,,Favorite Hymns for Organ,,,,,,,,38,,Hebble,,,
Christ for the World We Sing,,,,,Italian Hymn,,,,Pipe Dusters Vol 3,,,,,,,,9,,Smith,,,
"Christ Has Arisen, Alleliua",,,,,Mfurahini Haleluya,,,,"Were You There: Easy Hymn Preludes for Palm Sunday, Holy Week, and Easter",,,,,,,,22,,Kerr,,,Easter
"Christ Has Arisen, Alleliua",,,,,"Mfurahini, Haleluya",,,,Amen: World Hymns for Organ,,,,,,,,6,,Kerr,,,
Christ is Risen! Alleluia!,,,,,Morgenlied,,,,Easter Glory! Festive Organ Music for the Season,,,,,,,,12,,Balcombe,,,Easter
Christ Is the World's Light,,,,,Christe Sanctorum,,,,Six Preludes for the Church Year,,,,,,,,16,,Hobby,,,Epiphany
Christ the Lord Is Risen Today,,,,,Easter Hymn,,,,"O Sacred Head: An Organ Collection for Palm Sunday, Holy Week and Easter",,,,,,,,41,,Thomas,,,Easter
Christ the Lord Is Risen Today,,,,,Easter Hymn,,,,The Complete Organist,,,,,,,,51,,Thomas,,,Easter
Christ the Lord Is Risen Today,,,,,,,,,Big Brown Book of Organ Solos,,,,,,,,131,,Torrans,,,
Christ the Lord Is Risen Today,,,,,Easter Hymn,,,,Easter Glory! Festive Organ Music for the Season,,,,,,,,40,,Smith,,,Easter
Christ the Lord Is Risen Today,,,,,Easter Hymn,,,,Pipe Dusters Vol 3,,,,,,,,40,,Smith,,,Easter
Christ the Lord Is Risen Today,,,,,Orientis partibus,,,,The Parish Organist Part Three,,,,,,,,32,,Markworth,,,Easter
Christ the Redeemer,,,,,,,,,Go Forth in Faith: Festive Music of Praise for Organ,,,,,,,,25,,Birchwood,,,
Christ the Victor! Christ the King!,,,,,,,,,God of Glory: Easy Festive Postludes for Organ,,,,,,,,36,,Birchwood,,,
"Christ, Mighty Savior",,,,,Innisfree Farm,,,,Many and Great Hymn Settings for Organ,,,,,,,,4,,Farlee,,,
"Christ, Whose Glory Fills the Skies",,,,,Ratisbon,,,,The Parish Organist Part Twelve,,,,,,,,10,,Metzger,,,
"Christians, We Have Met to Worship",,,,,Holy Manna,,,,Hymns for Organ: Artistic Expressions of Faith and Joy,,,,,,,,3,,Hayes,,,
Cleansing Fountain,,,,,,,,,Communion Call-Meditations for Organ,,,,,,,,42,,Paxton,,,
Close to Thee,,,,,Close to Thee,,,,Close to Thee: Artistic Organ Settings of Eduring Gospel Songs,,,,,,,,18,,Southbridge,,,
Cold December Flies Away,,,,,Lo desembre congelat,,,,11 Compositions for Organ Set 5,,,,,,,,12,,Ore,,,Advent
Come Thou Fount of Every Blessing,,,,,Nettleton,,,,Churchworks,,,,,,,,8,,Koch,,,
"Come to Us, Creative Spirit",,,,,Castlewood,,,,Many and Great Hymn Settings for Organ,,,,,,,,6,,Farlee,,,
Come Unto Me,,,,,,,,,Chimings for Organ,,,,,,,,28,,Rasley,,,
"Come, Christians Join to Sing",,,,,,,,,Fanfare and Pageant of Praise,,,,,,,,20,,Wyrtzen,,,
"Come, Christians Join to Sing",,,,,,,,,"Loud Praise to Christ, Our King! Festive Hymn Settings for Organ",,,,,,,,5,,Martin,,,
"Come, Christians Join to Sing",,,,,,,,,"Rejoice, the Lord Is King",,,,,,,,6,,Haan,,,
"Come, Christians, Join to Sing",,,,,Madrid,,,,Easy Organ Library Vol 58,,,,,,,,39,,James,,,
"Come, Holy Spirit, Heavenly Dove",,,,,St. Agnes,,,,The Complete Organist,,,,,,,,63,,Douglas,,,Pentecost
"Come, Let Us Eat",,,,,,,,,Amen: World Hymns for Organ,,,,,,,,10,,Kerr,,,
"Come, O Thou Traveler Unknown",,,,,Candler,,,,Love Divine: Six Hymntunes on Wesley Texts,,,,,,,,16,,Burkhardt,,,
"Come, Thou Almight King",,,,,Italian Hymn,,,,Ancient of Days 3 Hymns of Praise,,,,,,,,6,,Laubengaye,,,
"Come, Thou Almighty King",,,,,,,,,Big Brown Book of Organ Solos,,,,,,,,50,,Wyrtzen,,,
"Come, Thou Almighty King",,,,,,,,,Organ Preludes on Hymns Old and New,,,,,,,,4,,Hustad,,,
"Come, Thou Fount of Every Blessing",,,,,Nettleton,,,,American Folk Hymn Suite for Organ,,,,,,,,8,,Burkhardt,,,
"Come, Thou Fount of Every Blessing",,,,,Nettleton,,,,Glad Adoration,,,,,,,,17,,Hamlin,,,
"Come, Thou Long Expected Jesus",,,,,Stuttgart,,,,The Parish Organist Part Twelve,,,,,,,,68,,Bender,,,
"Come, Thou Long-Expected Jesus",,,,,Jefferson,,,,Love Divine: Six Hymntunes on Wesley Texts,,,,,,,,10,,Burkhardt,,,
"Come, Thou Long-Expected Jesus",,,,,St. Hilary,,,,The Organist in Season: Winter,,,,,,,,12,,Karvonen,,,Advent
"Come, We That Love the Lord",,,,,Marching to Zion,,,,Many and Great Hymn Settings for Organ,,,,,,,,8,,Farlee,,,
"Come, We That Love the Lord",,,,,St. Thomas,,,,"Loud Praise to Christ, Our King! Festive Hymn Settings for Organ",,,,,,,,30,,Martin,,,
"Come, Ye Faithful, Raise the Strain",,,,,St. Kevin,,,,Risen & Exalted An Eastertide Celebration for Organ,,,,,,,,9,,Smith,,,Easter
"Come, Ye Faithful, Raise the Strain",,,,,St. Kevin,,,,"O Sacred Head: An Organ Collection for Palm Sunday, Holy Week and Easter",,,,,,,,35,,Bliss,,,Easter
"Come, Ye Sinners, Poor and Needy",,,,,,,,,"Rejoice, the Lord Is King",,,,,,,,32,,Haan,,,
"Come, Ye Thankful People, Come",,,,,St.George,,,,The Parish Organist Part Three,,,,,,,,44,,Gehrke,,,Thanksgiving
"Come,You Faithful, Raise the Strain",,,,,Gaudeamus Pariter,,,,The Organist in Season: Spring,,,,,,,,24,,Krapf,,,Easter
Communion Meditations,,,,,"EucharisticHymn,Martyrdom",,,,Easy Organ Library Vol 58,,,,,,,,28,,Smith,,,
Cornet Voluntary,,,,,,,,,Old English Organ Music for Manuals Book 2,,,,,,,,14,,Heron,,,
Cortege,,,,,,,,,Exaltation Festive Processionals for Organ,,,,,,,,28,,Wood,,,
Cradle Hymn Chorale Prelude,,,,,,,,,The Organist in Season: Winter,,,,,,,,32,,Powell,,,Christmas
Creator of the Stars of Night,,,,,Conditor Alme Siderum,,,,The Organist in Season: Winter,,,,,,,,8,,McCabe,,,Advent
Crown Him Lord of All!,,,,,Diadem,,,,Gather in Praise: Ten Hymns of Praise for Organ,,,,,,,,6,,Martin,,,
Crown Him With Many Crowns,,,,,Diademata,,,,Risen & Exalted An Eastertide Celebration for Organ,,,,,,,,21,,Smith,,,Ascension
Crown Him With Many Crowns,,,,,Diademata,,,,The Complete Organist,,,,,,,,46,,Neal,,,Ascension
Dance Prelude on Unser Herrscher,,,,,Unser Herrscher,,,,"Come, Christians, Join to Sing",,,,,,,,14,,Harmon,,,
Day by Day,,,,,Blott En Dag,,,,The Everlasting Arms,,,,,,,,6,,Smith,,,
Dear Lord and Father of Mankind,,,,,Rest,,,,The Organist in Season: Summer,,,,,,,,34,,Whitworth,,,Prayer
"Deck Yourself, My Soul, With Gladness",,,,,Schmucke Dich,,,,The Organist in Season: Autumn,,,,,,,,46,,Krapf,,,
Deep River,,,,,Deep River,,,,Funeral Music for a Manuals,,,,,,,,10,,Callahan,,,Funeral
Deo Gracias,,,,,Deo Gracias,,,,"O Love, How Deep: Three Hymn Settings for Organ",,,,,,,,12,,Phillips,,,
Diapason Movement,,,,,,,,,Old English Organ Music for Manuals Book 2,,,,,,,,6,,Keeble,,,
Diapason Movement,,,,,,,,,Old English Organ Music for Manuals Book 2,,,,,,,,17,,Goodwin,,,
Diapason Movement,,,,,,,,,Old English Organ Music for Manuals Book 2,,,,,,,,24,,Boyce,,,
Didn’t My Lord Deliver Daniel?,,,,,,,,,A Spiritual Service Based on African-American Spirituals,,,,,,,,12,,Inniss,,,
Divertissement (Gigue),,,,,,,,,Go Forth in Faith: Festive Music of Praise for Organ,,,,,,,,22,,Young,,,
Dove of Peace,,,,,I Come with Joy,,,,The Organist in Season: Summer,,,,,,,,9,,Martin,,,Communion
Dove of Peace,,,,,Dove of Peace,,,,Simple Gifs: Four American Hymn Preludes for Organ,,,,,,,,13,,Kosche,,,
Down to the River to Pray,,,,,The Good Old Way,,,,Easy Organ Library Vol 58,,,,,,,,84,,Hayes/Wagner,,,
Draw Nigh and Take the Body of the Lord,,,,,Old 124th,,,,The Parish Organist Part Three,,,,,,,,28,,Moser,,,
"Draw Thou My Soul, O Christ",,,,,St. Edmund,,,,Come to the Alter,,,,,,,,9,,Smith,,,
"Draw Thou My Soul, O Christ",,,,,St. Edmund,,,,Footsteps of Jesus: Favorite Hymns and Gospel Songs for Organ,,,,,,,,28,,Smith,,,
Dunlap's Creel,,,,,,,,,Eight Quiet Preludes on American Hymntunes,,,,,,,,8,,Callahan,,,
Easter Dialogue,,,,,Vulpius,,,,Easter Glory! Festive Organ Music for the Season,,,,,,,,43,,Martin,,,Easter
Epilogue for Trumpet,,,,,,,,,God of Glory: Easy Festive Postludes for Organ,,,,,,,,15,,Birchwood,,,
"Ever Faithful, Ever Near",,,,,,,,,The Complete Organist,,,,,,,,44,,Ritter,,,Lent
Everlasting Victory,,,,,,,,,"O Sacred Head: An Organ Collection for Palm Sunday, Holy Week and Easter",,,,,,,,32,,Turner,,,Easter
Every Time I Feel the Spirit,,,,,Pentecost,,,,Every Time I Feel the Spirit,,,,,,,,3,,Elliott,,,Pentecost
Fairest Lord Jesus,,,,,Crusaders' Hymn,,,,Diane Bish Organ Book,,,,,,,,46,,Bish,,,
Fairest Lord Jesus,,,,,Crusader's Hymn,,,,Glad Adoration,,,,,,,,8,,Hamlin,,,
Fairest Lord Jesus,,,,,Crusaders Hymn,,,,Favorite Hymns for Organ,,,,,,,,12,,Hebble,,,
Faith of Our Fathers,,,,,St. Catherin,,,,Nine Hymn Preludes for Organ,,,,,,,,2,,Young,,,
Faith of Our Fathers,,,,,St. Catherine,,,,Praise and Thanksgiving Hymn Improvisations Set 7,,,,,,,,12,,Burkhardt,,,
Fanfare,,,,,,,,,Pipe Dusters Vol 3,,,,,,,,20,,Raybuck,,,
Fanfare,,,,,,,,,Pipe Dusters Vol 3,,,,,,,,39,,Turner,,,
Fanfare and Pageant of Praise,,,,,,,,,Fanfare and Pageant of Praise,,,,,,,,5,,Wyrtzen,,,
Fanfare for a Resurrection Day,,,,,,,,,The Complete Organist,,,,,,,,66,,Scott,,,Easter
Fanfare of Praise,,,,,,,,,Easy Organ Library Vol 58,,,,,,,,12,,Krug,,,
Fanfare on an Original Theme,,,,,,,,,Pipe Dusters,,,,,,,,62,,Martin,,,
Fanfare on Ein Feste Burg,,,,,Ein Feste Burg,,,,Pipe Dusters,,,,,,,,6,,Pethel,,,
Fanfare to a Festive Occasion,,,,,,,,,Pipe Dusters Vol 3,,,,,,,,36,,Smith,,,
Fanfares and Flourishes,,,,,,,,,Pipe Dusters,,,,,,,,38,,Binckes,,,
"Fantasia on ""Duke Street""",,,,,Duke Street,,,,Gather in Praise: Ten Hymns of Praise for Organ,,,,,,,,9,,Smith,,,
"Fantasia on ""Salvation""",,,,,Salvation,,,,Gather in Praise: Ten Hymns of Praise for Organ,,,,,,,,27,,Paxton,,,
Fantasia on Forest Green,,,,,,,,,The Complete Organist,,,,,,,,40,,Smith,,,Christmas
"Farewell, Good Friends",,,,,"Shalom, Chaverin",,,,Eight Hymn Preludes for Organ,,,,,,,,25,,Diemer,,,
"Father, We Thank You",,,,,Rendez a Dieu ,,,,Many and Great Hymn Settings for Organ,,,,,,,,11,,Farlee,,,
Festal Piece,,,,,,,,,Pipe Dusters,,,,,,,,10,,Handel,,,
Festal Postlude,,,,,,,,,Pipe Dusters,,,,,,,,72,,Powell,,,
Festival Bridal Chorus,,,,,,,,,Fanfare and Pageant of Praise,,,,,,,,26,,Wyrtzen,,,
Festival March,,,,,,,,,Power and Praise: Festive Organ Music for the Service,,,,,,,,40,,Powell,,,
Festive Introit,,,,,,,,,Pipe Dusters Vol 3,,,,,,,,22,,Prentiss,,,
Festive March in D,,,,,,,,,Pipe Dusters,,,,,,,,3,,Rebikoff,,,
Festive Procession,,,,,,,,,The Complete Wedding Collection II,,,,,,,,2,,Darwall,,,
Festive Voluntary,,,,,,,,,Pipe Dusters,,,,,,,,50,,Purcell,,,
Fill the Earth With Music,,,,,Wye Valley,,,,Fill the Earth With Music: Easy Music for Organ,,,,,,,,4,,Edwards,,,
Finale,,,,,,,,,Pipe Dusters,,,,,,,,60,,Martin,,,
Finale in C Minor,,,,,,,,,Pipe Dusters Vol 3,,,,,,,,14,,Saxton,,,
Finale Jublilante,,,,,,,,,The Complete Wedding Collection II,,,,,,,,17,,Willan,,,
Fling Wide the Door,,,,,Macht Hoch Die Tur,,,,Many and Great Hymn Settings for Organ,,,,,,,,15,,Farlee,,,
Fling Wide the Gates,,,,,,,,,Easter Glory! Festive Organ Music for the Season,,,,,,,,9,,Smith,,,Easter
